date,headline,crypto
2024-09-16,Trader Shares '3 Contrarian Takes:' TRUMP Meme Coin 'An Obvious Buy' And These 2 Cryptos Are 'Deep Value' And Will Be 'Outperforming Soon',XRP
2024-09-16,"Crypto Today: Bitcoin, Ethereum dip slightly, XRP flat on Monday as dormant Ether whale is back in action",XRP
2024-09-17,XRP’s Bearish Phase Ending? Eyes on $0.75 Level,XRP
2024-09-17,XRP ‘The Safest Investment To Make 100% ROI’ – Former Asset Manager Shares Price Targets,XRP
2024-09-17,Analyst Identifies $0.75 As Most Crucial Target For XRP Price In The Campaign For $1,XRP
2024-09-17,“Good Tech” Leads Altcoin Bounce,XRP
2024-09-17,"Crypto Today: Bitcoin breaks past $60,000, Ethereum and XRP gain slightly",XRP
2024-09-18,Solana (SOL) Could Crash 40% If It Stays Below $140 – Top Analyst Shares Insights,XRP
2024-09-18,"XRP Whale Dump 18 Million Tokens, Will Price Drop?",XRP
2024-09-18,"Crypto Analyst Says Bitcoin All-Time High Only A Month Away After Breaking $60,000",XRP
2024-09-18,"Crypto Expert Dismisses Calls Of Ripple’s XRP Price Flying To $1,000 For This Reason",XRP
2024-09-18,XRP Struggles for a Comeback: Will It Hit $0.63 or Drop More?,XRP
2024-09-19,"XRP Price Prediction: Crypto Pundit Predicts Historical 9,468% Pump To $27",XRP
2024-09-19,Blockchain Industry Players Launch MiCA Crypto Alliance in the EU,XRP
2024-09-19,Grayscale’s XRP Trust Shows Strong Institutional Interest with 11.44% NAV Growth,XRP
2024-09-19,XRP Poised for Major Price Jump as Whales Buy In,XRP
2024-09-19,"Crypto Today: Bitcoin breaks $63,500, Ethereum closer to $2,500, XRP holds steady above $0.58",XRP
2024-09-20,"Grayscale XRP Trust Surges 11.44% One Week After Launch, Here’s The Catalyst",XRP
2024-09-20,XRP slips to $0.58 as Ripple CLO makes note of SEC loss and regulatory gaps in crypto,XRP
2024-09-20,Ripple’s Fate Looms as SEC Flirts with October Appeal Deadline,XRP
2024-09-20,"Dogecoin Open interest Remains Muted Below $500 Million, What’s Going On?",XRP
2024-09-20,India's Supreme Court YouTube Channel Hacked to Shill XRP Crypto Scam,XRP
2024-09-21,"XRP False Breakout Triggers $1.4 Million Liquidation, What’s Next?",XRP
2024-09-21,Ripple Vs SEC Lawsuit: Last Minute Appeal By US SEC in XRP Case,XRP
2024-09-21,John Deaton Confirms Debate Date With Senator Elizabeth Warren,XRP
2024-09-21,Ethereum (ETH) Price Rally at Risk as First Sell Signals Appear in 3 Weeks,XRP
2024-09-21,Is XRP supply running low? Here’s what it means for retail investors,XRP
2024-09-22,XRP Price Breakout to 30% Rally Next as Investor Inflows Explode,XRP
2024-09-22,"Ripple CTO Denies XRP Price Suppression Accusations, Claims He Would Raise Price If He Could",XRP
2024-09-22,XRP Price Prediction for September 22,XRP
2024-09-22,SEC Appeal Imminent? Ripple Awaits Decision as XRP Shifts,XRP
2024-09-22,Pro-Crypto Senate Candidate John Deaton Set to Debate Elizabeth Warren in October,XRP
2024-09-23,"BTC, ETH and XRP Price Prediction for September 23",XRP
2024-09-23,XRP Exchange Outflows Signal a 12% Price Surge Ahead,XRP
2024-09-23,"Price analysis 9/23: SPX, DXY, BTC, ETH, BNB, SOL, XRP, DOGE, TON, ADA",XRP
2024-09-23,"XRP Dwarfs Cardano, Ethereum by Weekly Institutional Inflows",XRP
2024-09-23,"Crypto Flows Top $321 Million, BTC, ETH and XRP Stun Market",XRP
2024-09-24,"XRP Ledger Secures Major Update, Here's What's Changed",XRP
2024-09-24,"Robinhood Adds UNI, XLM, And XTZ For NY Users; Is XRP Next?",XRP
2024-09-24,"Analysts Reveal Why $1,000 In Cutoshi Is More Profitable Than Buying PEPE, BNB, XRP, FET",XRP
2024-09-24,"Crypto Price Analysis for Today: Here are TIA, AR, NEAR, WLD, & HBAR Price Targets for September Close",XRP
2024-09-24,"Crypto Prices Today Sept 24: BTC And Major Altcoin Pullback, TIA Up 16%",XRP
2024-09-25,Binance Market Update (2024-09-25),XRP
2024-09-25,Ethereum ETFs See Largest Outflows Since July: Is Waning Institutional Demand Hurting ETH?,XRP
2024-09-27,Grayscale Predicts Top Altcoins that Can Outperform in Q4 2024,XRP
2024-09-27,Stacks: New Network Upgrades Push STX Price Up By 18% – Details,XRP
2024-09-28,"Analyst Now Says XRP Will Surge To $1,000",XRP
2024-09-28,XRP Bulls Take Over—Will Ripple’s Price Hit $0.75 After This Breakout?,XRP
2024-09-28,XRP All Set To Reclaim $0.72: Smart Money Analyst,XRP
2024-09-29,ETH Rally Pushes Profitability To Nearly 70%: More To Come This Week?,XRP
2024-09-29,Internet Computer (ICP) Continues Upward Trajectory With 16% Rally,XRP
2024-09-29,"Bitcoin’s strong monthly close could spark a rally in XRP, TAO, RUNE and SEI",XRP
2024-09-29,"XRP Set To Soar Nearly 900% To $31, Analyst Highlights Key Resistance",XRP
2024-09-30,"Price analysis 9/30: SPX, DXY, BTC, ETH, BNB, SOL, XRP, DOGE, TON, ADA",XRP
2024-09-30,Crypto Market Holds Strong Despite Monday Dip: MOODENG and ETHW Shine,XRP
2024-09-30,"CoinDesk 20 Performance Update: Index Posts Losses, but XRP Rises From Friday",XRP
2024-09-30,Digital Asset Investment Products See Third Consecutive Week of Inflows,XRP
2024-09-30,"XRP To $1,000? Experts Weigh In On Bold Predictions And Market Realities",XRP
2024-10-01,"Robinhood Europe Enables Transfers For 24 Crypto, Excludes XRP & TON",XRP
2024-10-01,"Bitcoin To $80,000, Dogwifhat To $7, And Fantom To $1? Analyst Shares ‘Realistic Targets’",XRP
2024-10-02,"The Daily: FTX estate prepares to sell locked Worldcoin tokens at a discount, Bitwise files for a spot XRP ETF and more",XRP
2024-10-02,FOMO HOUR 210 - MIDDLE EAST TENSIONS RISE,XRP
2024-10-02,CoinDesk 20 Performance Update: Ripple's XRP Drops 5.1% as Nearly All Assets Decline,XRP
2024-10-02,Ripple’s cross-border payment innovations challenge SWIFT dominance,XRP
2024-10-02,Eigen Token Staking Rewards and Lockup Details Out: Check Here,XRP
2024-10-03,Crypto Analyst Maintains $7.50 XRP Target Despite SEC Appeal Against Ripple,XRP
2024-10-03,"The Daily: SEC appeals Ripple case ruling, Swift plans live bank trials of digital asset transactions and more",XRP
2024-10-03,Axelar Launches Mobius with Babylon and EigenLayer Integration,XRP
2024-10-03,SEC’s XRP Appeal: Ripple’s Legal Fight Heats Up Again,XRP
2024-10-03,"What’s Holding Bitcoin Back? Analyst Says $71,000 Is The Magic Number",XRP
2024-10-04,XRP Traders See SEC Appeal as the Final Shakeout Before Recovery,XRP
2024-10-04,"This Week in Crypto: Telegram Airdrops, Grayscale’s Top Altcoins, and SEC-Ripple Drama",XRP
2024-10-04,Bitwise Futures ETFs Seek New Edge in Crypto and US Treasuries,XRP
2024-10-04,"Crypto Price Today (Oct 4, 2024): $1B Bitcoin Options Expire, Hamster Kombat Memecoin Down 52% Since Launch!",XRP
2024-10-04,"Crypto Price Analysis 10-4 BITCOIN: BTC, ETHEREUM: ETH, SOLANA: SOL, RIPPLE: XRP, DOGECOIN: DOGE, COSMOS: ATOM, CELESTIA: TIA",XRP
2024-10-05,"Crypto Trader Flips Bullish on One Large-Cap Ethereum (ETH) Competitor, Updates Outlook on XRP and Curve (CRV)",XRP
2024-10-06,"LATAM Crypto Roundup: Binance Secures VASP Registration in Argentina, Ripple Expands in Brazil, and More",XRP
2024-10-06,Crypto Analyst Shares Bullish Outlook on Solana and Two Other Altcoins,XRP
2024-10-06,"Nigeria’s Oil-for-Naira Program, Blackrock’s New Stablecoin, and More — Week in Review",XRP
2024-10-06,Binance Market Update (2024-10-06),XRP
2024-10-07,"Price analysis 10/7: SPX, DXY, BTC, ETH, BNB, SOL, XRP, DOGE, TON, ADA",XRP
2024-10-07,"XRP Takes A 16% Hit In SEC Lawsuit Drama, But Analysts See Hope",XRP
2024-10-07,Shiba Inu's Shytoshi Kusama Calls This Nation 'Crypto Capital' After It Makes Digital Asset Transactions Tax Free,XRP
2024-10-08,Canary Capital files for a spot XRP exchange-traded fund with the SEC,XRP
2024-10-08,"Dogecoin Could Be Preparing For Next Big Rally, Analyst Explains",XRP
2024-10-08,Experts Discuss What Made Solana Memecoins The Cycle’s Top Narrative,XRP
2024-10-08,"Fantom Price Slumps, XRP News Ignites Renewed Interests, and RollBlock Presale Surpasses $4Million",XRP
2024-10-08,Cryptocurrency Prices On Oct 8: BTC Wanes To $62K But SUI & NEIRO Up 11%-19%,XRP
2024-10-09,Another Firm Seeks SEC Approval for Spot XRP ETF,XRP
2024-10-09,"This Altcoin May Hit $10 Before UNI, TON, TIA or NEAR—Here’s What’s Next for EigenLayer (EIGEN) Price Rally",XRP
2024-10-09,Crypto Prices Today October 9: BTC & Altcoins Turbulent But EIGEN Soars 9%,XRP
2024-10-10,"Here Are 20 Crypto Assets With the ‘Best Chance’ of Rallying Based on Sentiment, According to Analytics Firm",XRP
2024-10-10,Explosive Growth: NEAR Protocol Caters To 3 Million Daily Users,XRP
2024-10-10,Ripple Launches New Crypto Custody Services for Banks and Fintech,XRP
2024-10-10,"Crypto Price Analysis 10-10 BITCOIN: BTC, ETHEREUM: ETH, SOLANA: SOL, DOGWIFHAT: WIF, CHAINLINK: LINK, SEI: SEI, ARTIFICIAL SUPERINTELLIGENCE ALLIANCE: FET",XRP
2024-10-11,Ripple Defies SEC—How the Cross-Appeal Aims to Alter Crypto Law,XRP
2024-10-11,"Crypto Today: Bitcoin, Ethereum and XRP gain on Friday, meme coin NEIRO erases recent gains",XRP
2024-10-11,"Crypto Price Analysis 10-11 BITCOIN: BTC, ETHEREUM: ETH, SOLANA: SOL, RIPPLE: XRP, DOGECOIN: DOGE, BITTENSOR: TAO, FANTOM: FTM",XRP
2024-10-12,"Expert Dissects $60 Forecast For XRP Price, Institutional Investors Are The Key",XRP
2024-10-14,"Price analysis 10/14: SPX, DXY, BTC, ETH, BNB, SOL, XRP, DOGE, TON, ADA",XRP
2024-10-14,4 Crypto Airdrops for the Third Week of October: Here’s What to Know,XRP
2024-10-14,BlockDAG Nears $100M! XRP ETF Progress and Bitcoin Cash Updates,XRP
2024-10-14,"Crypto Price Analysis 10-14 BITCOIN: BTC, ETHEREUM: ETH, SOLANA: SOL, RIPPLE: XRP, DOGECOIN: DOGE, POLKADOT: DOT, INJECTIVE: INJ",XRP
2024-10-14,Ripple CEO Slams SEC for Ignoring Court Ruling on XRP,XRP
2024-10-15,Canary Capital seeks approval from SEC for a spot Litecoin ETF,XRP
2024-10-15,"Ripple names Bitstamp, Bitso and Bullish among exchange partners ahead of stablecoin launch",XRP
2024-10-15,"Crypto Prices Today Oct 15: BTC Breaches $65K, ETH, SOL, & XRP Gain 4%-7%",XRP
2024-10-16,"Dogecoin Sees Sharp Decline: Over 106,000 Wallets Abandon The Memecoin",XRP
2024-10-16,Binance Market Update (2024-10-16),XRP
2024-10-16,"Cryptocurrency Prices Today Oct 16: BTC Tops $67K, LTC & CHZ Up 4-7%",XRP
2024-10-16,"Crypto Analyst Identifies Bull Flag That Could Send Solana Price To $1,400",XRP
2024-10-17,"XRP, Litecoin and Bitcoin Cash Lead the Rally – Could a Major Market Announcement Be Coming This Week?",XRP
2024-10-18,"Aave Address Count On Optimism Rapidly Growing, Will Price Rise To New 13-Month High?",XRP
2024-10-18,"Huge week for BTC ETFs, Crypto now through Venmo, Memes Dominate Gainers",XRP
2024-10-18,"The Daily: DBS introduces tokenized banking services, BlackRock’s Bitcoin ETF attracts $1 billion in less than a week and more",XRP
2024-10-18,XRP Could Plummet 30% as Ripple Faces Renewed SEC Legal Battle,XRP
2024-10-18,SEC vs. Ripple Showdown: Legal Battle Set to Drag on Until July 2025,XRP
2024-10-19,Crypto Whales Propel BlockDAG Presale to $100M – Stacks (STX) Surges While XRP Encounters Difficulties,XRP
2024-10-19,"There is this interesting phenomenon where some coins pumping might indicate overall market strength or weakness.

Don't ask me why but this has historically worked out pretty well. Mainly last cycle.

Bad omens:
$XRP
$ATOM

Good omens:
$DOGE
$LINK

Which other ones do you know?",XRP
2024-10-19,"Crypto Prices Today Oct 19: BTC Holds $68K, Altcoins Gain In Sync, SAND Up 12%",XRP
2024-10-20,TRON Market Cap Hits Nearly $14 Billion On Strong Revenue Growth,XRP
2024-10-21,ApeCoin Climbs Over 100% On Major Tech Advancements – Details,XRP
2024-10-21,"Crypto Today: Bitcoin, Ethereum lose gains, XRP corrects on Monday, traders brace for $400 million unlocks",XRP
2024-10-21,"Elon Musk Mentions XRP at Pennsylvania Rally, Boosts Price",XRP
2024-10-21,"Crypto Price Analysis 10-21 BITCOIN: BTC, ETHEREUM: ETH, SOLANA: SOL, RIPPLE: XRP, POLKADOT: DOT, OPTIMISM: OP, AKASH NETWORK: AKT",XRP
2024-10-21,TRASTRA and Quicko Launch Virtual Mastercard-Branded Card for Cryptocurrency Users,XRP
2024-10-22,"SOL Outperforms, 10y Rises above 4.2%, AI Tokens Dominate flows",XRP
2024-10-22,"Price analysis 10/22: SPX, DXY, BTC, ETH, BNB, SOL, XRP, DOGE, TON, ADA",XRP
2024-10-22,Ripple sells $100 million of XRP amid shy ‘Uptober’ and Kamala Harris donation,XRP
2024-10-23,"3 Reasons Why Chinese Investors are Pumping $500,000 Into IntelMarkets While NEAR & XRP Dump",XRP
2024-10-23,"The Protocol: Justin Sun, Bitcoin Mempool Sniping, XRP for Harris, Inspirational Women",XRP
2024-10-23,Why Ripple (XRP) and Stellar (XLM) Holders are Flocking to Zig Network (ZIG),XRP
2024-10-23,"Crypto Price Analysis 10-23 BITCOIN: BTC, ETHEREUM: ETH, SOLANA: SOL, POPCAT: POPCAT, UNISWAP: UNI, TRON: TRX, APECOIN: APE",XRP
2024-10-23,"Cryptocurrency Prices Today Oct 23: BTC Holds $67K, BEAM & POPCAT Surge 6%",XRP
2024-10-24,"Crypto Price Analysis 10-24 BITCOIN: BTC, ETHEREUM: ETH, SOLANA: SOL, DOGECOIN: DOGE, CELESTIA: TIA, POLKADOT:DOT, RIPPLE: XRP",XRP
2024-10-24,"Veteran Analyst Predicts XRP Will Never Reach $5, Shiba Inu Won’t Hit $1—But This $0.00025 POL Meme Token Could Deliver 39,900% Returns",XRP
2024-10-24,"Crypto Today: Bitcoin, Ethereum and XRP note slight increase on Thursday",XRP
2024-10-24,Exploring Zig Network (ZIG): Is It the Future of Crypto vs. Dogecoin (DOGE) and Ripple (XRP)?,XRP
2024-10-24,"Crypto Prices Today Oct 24: BTC At $67K, Altcoins Flux, & GOAT Up 50%",XRP
2024-10-25,Ripple contests prior ruling’s Howey test application on XRP institutional sales in appeal,XRP
2024-10-25,"Cryptocurrency Prices Today Oct 25: BTC Crosses $68K, SAFE Rockets 73%",XRP
2024-10-26,What is happening to crypto market today: Crypto News Update,XRP
2024-10-27,Exploring the Impact of Zig Network (ZIG) on Ripple (XRP) and Polkadot (DOT) Market Dynamics,XRP
2024-10-28,SEC Delays Ripple (XRP) Appeal to 2025 While Investors Pivot to this New AI Crypto and Artificial Superintelligence Alliance (FET),XRP
2024-10-28,"Price analysis 10/28: SPX, DXY, BTC, ETH, BNB, SOL, XRP, DOGE, TON, ADA",XRP
2024-10-29,"DOGE Surges By 28%, BRETT & SUI by 12%, ENA by 15%—Is This the Beginning of an Altseason?",XRP
2024-10-29,"Crypto Market Live Today: Bitcoin Strikes $71,000, Memecoins Trigger Huge Upswing While ETH, XRP, ADA & SOL Attract Decent Gains",XRP
2024-10-29,"Crypto Market Rally: Here’s Why Bitcoin, ETH, XRP, DOGE, SHIB Are Rising",XRP
2024-10-30,NYSE Arca Seeks SEC Approval to List Grayscale’s Diverse Crypto ETF,XRP
2024-10-30,"Crypto Price Analysis 10-30 BITCOIN: BTC, ETHEREUM: ETH, SOLANA: SOL, DOGECOIN: DOGE, RIPPLE: XRP, INTERNET COMPUTER: ICP, CELESTIA: TIA",XRP
2024-10-30,Binance Market Update (2024-10-30),XRP
2024-10-31,Harris Vs Trump: Crypto Industry Anticipates 'Favorable Regulatory Environment' For Bitcoin And Other Digital Assets After Elections,XRP
2024-10-31,XRP ETF Around The Corner: As SEC Acknowledged Grayscale’s ETF Change,XRP
2024-11-01,"Think You Know JasmyCoin, XYZVerse, and XRP? Here’s Why They Could Be Worth Much More",XRP
2024-11-01,21Shares looks to secure SEC approval for XRP ETF amid growing interest in other crypto funds,XRP
2024-11-01,What Crypto Whales Are Buying for Potential Gains in November 2024,XRP
2024-11-01,"Crypto Price Analysis 11-1 BITCOIN: BTC, ETHEREUM: ETH, SOLANA: SOL, RIPPLE: XRP, CHAINLINK: LINK, ARTIFICIAL SUPERINTELLIGENCE ALLIANCE: FET, RENDER: RNDR",XRP
2024-11-01,"Crypto Price Analysis November-01: XRP, BNB, SOL, DOGE, and MKR",XRP
2024-11-02,Institutional Demand Drives Confidence for Ripple's XRP,XRP
2024-11-02,"Crypto Prices Today November 2: BTC At $69K, Altcoins Flux, RAY Soars 15%",XRP
2024-11-03,Coins to Watch Closely in November & December: These Could Turn Ordinary Joes into Millionaires by Q1 2025,XRP
2024-11-03,"Solana Rises 1,400% Despite Jim Cramer’s ‘Idiot’ Criticism",XRP
2024-11-04,"DOGE, XRP Surprisingly Outperformed All Cryptos",XRP
2024-11-04,Why One Analyst Says Now’s The Time To Buy XRP—Before It Hits $14,XRP
2024-11-04,"Crypto Price Analysis 11-4 BITCOIN: BTC, ETHEREUM: ETH, SOLANA: SOL, DOGECOIN: DOGE, RIPPLE: XRP, POLKADOT: DOT, INJECTIVE: INJ",XRP
2024-11-04,"Cryptocurrency Prices Today Nov 4: BTC Holds $69K, GOAT And TRUMP Tokens Surge 25%",XRP
2024-11-05,"Donald Trump Crypto Policies for 2024 : SEC Reform, National Bitcoin Strategy, and More",XRP
2024-11-06,Solana Rockets Past BNB To Claim Coveted 4th Spot In Crypto Ranks,XRP
2024-11-06,XRP Market Cap Risks Falling Behind DOGE Despite 5% Increase,XRP
2024-11-06,"Crypto Price Analysis 11-6 BITCOIN: BTC, ETHEREUM: ETH, SOLANA: SOL, APECOIN: APE, RIPPLE: XRP, DOGECOIN: DOGE, FANTOM: FTM",XRP
2024-11-06,"Solana User Base Skyrockets To Over 123 Million, Riding The Memecoin Wave",XRP
2024-11-08,Here’s what happened to Ripple’s prepared ‘largest XRP dump’ in 7 years,XRP
2024-11-08,"Crypto Prices Today Nov 8: BTC At $75K, Altcoins Flux, NEIRO Up 22%",XRP
2024-11-09,"BTC & Stocks ATH, FED decision today, PNUT hits $125M",XRP
2024-11-09,"Cryptocurrency Prices Today Nov 9: BTC Touches $77K, CRO Soars 17%, GOAT Crashes 10%",XRP
2024-11-10,Altseason 2024: Why Crypto Investors Are Flocking to Ethereum and XRP Right Now!,XRP
2024-11-10,Will Shiba Inu Price Jump Over 300%? This Analyst Thinks So,XRP
2024-11-10,"Chainlink 125% Target In Sight As Whale, On-Chain Activity Soar—Analyst",XRP
2024-11-11,"Price analysis 11/11: SPX, DXY, BTC, ETH, SOL, BNB, DOGE, XRP, ADA, TON",XRP
2024-11-11,"Crypto Price Analysis 11-11 BITCOIN: BTC, ETHEREUM: ETH, SOLANA: SOL, POLKADOT: DOT, RIPPLE: XRP, TONCOIN: TON, UNISWAP: UNI",XRP
2024-11-12,XRP Edges To $1: Is Now The Time To Buy?,XRP
2024-11-12,Canary Capital Files for First Hedera (HBAR) Spot ETF with SEC: Will It Be Approved?,XRP
2024-11-12,"Crypto News: SHIB, DOGE, BTC, ETH, BONK, XRP Price Updates",XRP
2024-11-12,"Dogecoin, Bitcoin Returns Are Dazzling But First Neiro On Ethereum And Popcat Have Run Up 55000% and 20000% So Far In 2024",XRP
2024-11-12,"Cryptocurrency Prices Today Nov 12: BTC Hits $89K, CRO Soars 45%, ACT Up 2500%",XRP
2024-11-13,"ADA On Fire: Cardano 80% Surge Sparks 1,700% Bullish Forecast",XRP
2024-11-13,XRP price breakout in the cards as multi-year resistance falls,XRP
2024-11-13,Department Of Justice Seeks To Seize $16 Million In Crypto Assets Tied To FTX Bribery Case,XRP
2024-11-13,"Robinhood is Listing Solana, Cardano, Ripple, and PEPE Amidst US Regulatory Shift",XRP
2024-11-13,DOJ targets $16 million in Binance account tied to Sam Bankman-Fried bribery case,XRP
2024-11-14,Crypto Markets Surge After Trump’s Victory,XRP
2024-11-14,XRP Ledger To Host Societe Generale-Forge’s EURCV Stablecoin,XRP
2024-11-14,Societe Generale expands its stablecoin to Ripple’s XRP Ledger to drive further adoption,XRP
2024-11-14,Analysts Eye $50 For Avalanche As AVAX Jumps 28% – Details,XRP
2024-11-14,"SocGen Crypto Arm to Bring Its Euro Stablecoin to XRP Ledger, Lays Out Plan for Going Multichain",XRP
2024-11-15,Societe Generale Expands Stablecoin to XRP Ledger for Faster Cross-Border Payments,XRP
2024-11-15,Crypto Whales Bought These Altcoins in the Second Week of November 2024,XRP
2024-11-15,4 Crypto That Could Explode in November?,XRP
2024-11-15,"Best Crypto to Buy Now November 15 – Brett, Hedera, XRP",XRP
2024-11-15,"BTC pulls back to $87K, Hawkish Powell, MOODENG hits $650M",XRP
2024-11-16,XRP’s $50 billion market cap milestone – Is $2 REALLY on the cards?,XRP
2024-11-16,What Happened in Crypto Market Today: Why Crypto Market is Up?,XRP
2024-11-16,Altcoin Market Experiences Brief Respite With Notable Gains,XRP
2024-11-16,Cardano (ADA) To Reach $6 By September 2025? Analyst Forecast 2021-Like Rally,XRP
2024-11-16,"Binance Market Update: Top Stories November 16, 2024",XRP
2024-11-17,"Binance Market Update: Top Stories November 17, 2024",XRP
2024-11-17,"Trump Presidency Unlocked $800 Billion for US Crypto, Says Ripple CEO as ADA, SOL, and XRP Eye Golden Era",XRP
2024-11-17,"Bitcoin Projected To Hit $1.5 Million By 2030, Says ARK Invest CEO Cathie Wood",XRP
2024-11-17,"XRP, Cardano race ahead as legacy tokens fall behind: What’s happening?",XRP
2024-11-17,"Cryptocurrency Prices Today Nov 17: BTC Slips to $90K, XRP Rally, Meme Coins Fall",XRP
2024-11-18,"Price analysis 11/18: SPX, DXY, BTC, ETH, SOL, BNB, XRP, DOGE, ADA, SHIB",XRP
2024-11-18,XRP vs. FTM: How Will Cross $1 First? Experts Predict INTL & AVAX Will Soar 200% Faster,XRP
2024-11-18,"Crypto Price Analysis 11-18 BITCOIN: BTC, ETHEREUM: ETH, SOLANA: SOL, POLKADOT: DOT, DOGECOIN: DOGE, RIPPLE: XRP, CELESTIA: TIA",XRP
2024-11-18,"Bitcoin Dominance Decline Expected Next Month, Analyst Projects 'Altseason' To Peak By March 2025",XRP
2024-11-19,"Cryptocurrency Prices Today Nov 19: BTC Climbs to $91K, HBAR & XTZ Gain 40%",XRP
2024-11-19,XRP Now Achieves Highest Weekly Close in Three Years,XRP
2024-11-20,"$4,000 Solana Price Possible As SOL Breaks Out Of Massive Cup And Handle Pattern",XRP
2024-11-20,"Crypto Prices Today, Nov 20: BTC Hits New ATH, GOAT and BONK Rise 8-13%",XRP
2024-11-20,Solana Market Cap Hits Milestone: $400 Price Target Gains Traction,XRP
2024-11-21,"Bitcoin, Ethereum, Dogecoin Prepping For An Early Thanksgiving: 'BTC Is Currently (Less Than) One ETH Away From $100,000,' Says Trader",XRP
2024-11-21,"The 4 Top Cryptos for Long-Term Investment: How Polkadot, Dogecoin, XRP & BlockDAG Stack Up",XRP
2024-11-21,"Binance Market Update: Top Stories November 21, 2024",XRP
2024-11-21,Solana ETF: Bitwise Enters the Race for SOL ETF in Delaware,XRP
2024-11-21,Bitwise Files for Solana ETF as Donald Trump Era Sparks Crypto Optimism,XRP
2024-11-22,"Bitcoin Officially In Overheated MVRV Zone, Rally End Near?",XRP
2024-11-22,Ripple Victory? XRP Breaks $1.40 as SEC Chair Steps Down!,XRP
2024-11-22,"Crypto Price Analysis November-22: XRP, ADA, OP, SOL, and DOGE",XRP
2024-11-22,"Shiba Inu Could See A 53% Surge If This Resistance Breaks, Analyst Explains",XRP
2024-11-22,Weekly Market Highlights - The Beginnings of a Pro-Crypto United States of America,XRP
2024-11-23,Asset Tokenization Altcoin Skyrockets by 110% in a Day Amid New Partnership With SEC-Registered Broker-Dealer,XRP
2024-11-23,Kraken Explores More Token Listings Amid Trump-Driven Crypto Optimism,XRP
2024-11-23,XRP ETF Coming in 2025? Here’s the Timeline to Watch,XRP
2024-11-23,Will XRP Pull a 2017-Like Rally and Hit $5 Amid Open Interest Hitting All-Time High?,XRP
2024-11-23,Prominent advocates and analysts say XRP’s days below $1 are over,XRP
2024-11-24,"Crypto liquidations reach $470M as Bitcoin retraces, altcoins surge",XRP
2024-11-24,Dogecoin Experiences Volatility Amid Crypto Market Fluctuations,XRP
2024-11-24,Cardano Achieves 'A' Rating in Weiss Crypto Rankings,XRP
2024-11-24,Binance Market Update (2024-11-24),XRP
2024-11-24,"BTC nears $100K, Citron shorts MicroStrategy, REKT coins launches, MOG hits $1B",XRP
2024-11-25,"EXCLUSIVE: Tim Draper Predicts Bitcoin To Reach $120K By End Of 2024, $250K In 2025",XRP
2024-11-25,"Bloomberg Analyst Shares Timeline On SOL, XRP, LTC, HBAR ETFs’ Approval",XRP
2024-11-25,Solana (SOL) ATH Sparks $309 Price Prediction Frenzy – Details,XRP
2024-11-25,"Price analysis 11/25: SPX, DXY, BTC, ETH, SOL, BNB, XRP, DOGE, ADA, AVAX",XRP
2024-11-25,$100 billion WisdomTree files for XRP ETF via Delaware trust,XRP
2024-11-26,Ripple's XRP sees decline as realized profits reach record levels,XRP
2024-11-26,"Jed McCaleb: ""Stellar Is Very Different from Ripple""",XRP
2024-11-26,"BTC dips to $91K then Rebounds, Trump plans tariffs, Base szn begins, Chillguy back to $500M",XRP
2024-11-26,Flare is Building a ‘Fully Decentralized’ DeFi Hub: Co-Founder,XRP
2024-11-26,Crypto inflows surge as Bitcoin ETFs lead the way – Trump effect?,XRP
2024-11-27,"21Shares Launches Four New Crypto ETPs for ONDO, PYTH, RENDER and NEAR",XRP
2024-11-27,BitWise Files for 10 Crypto Index ETF with SEC,XRP
2024-11-27,21Shares Is Launching Four New Crypto ETPs Focusing on AI Tokens,XRP
2024-11-27,Ripple invests in Bitwise’s rebranded Physical XRP ETF,XRP
2024-11-27,Ripple Invests in Bitwise’s XRP ETP as Token Price Surge,XRP
2024-11-28,Dogecoin (DOGE) Market Cap Surpasses Porsche Amid ETP Launch. Top Altcoins Dominate the News Cycle,XRP
2024-11-28,XLM Price Kickstarts Parabolic Rally to $1 After Recent Breakout,XRP
2024-11-28,"ENS jumps 32%, ENA 18% as Bitcoin blinks to $97k",XRP
2024-11-28,Bitwise Files for 10 Crypto Index Fund ETF with SEC Approval,XRP
2024-11-28,"Bitcoin Price News: Bitcoin Surges Above $97K Before Dropping Back to $95.5K as Ether, XRP Lead Gains",XRP
2024-11-29,"Bitcoin, Ethereum, Dogecoin Climb, But Ripple Rockets: Analyst Calls It 'An Insane Period'",XRP
2024-11-29,New York regulator set to approve Ripple’s RLUSD stablecoin: Report,XRP
2024-11-29,"XRP Overtakes BNB As Fifth-Largest Crypto, Market Cap Nears $100 Billion",XRP
2024-11-29,ADA Price Up 4.5% In 24 Hours: Why Is Cardano Going Up?,XRP
2024-11-29,XRP Price Soars 20% In 24 Hours: Why Is XRP Up?,XRP
2024-11-30,"XRP Price Hits 7-Year High, Now Up 274% This Month",XRP
2024-11-30,Toncoin Price Explodes With 17% Rally — Can TON Sustain The Momentum?,XRP
2024-11-30,Ripple (XRP) Price Up Over 10% in 24 Hours: Why is it Pumping?,XRP
2024-11-30,"BTC at $97K, HYPE has Massive Airdrop, VIRTUAL hits $1.4B FDV",XRP
2024-11-30,Altcoin Gains Push Grayscale Crypto Portfolio Up 85%,XRP
2024-12-01,Morgan Creek’s Mark Yusko Unveils His Top Five Altcoin Picks Heading Into 2025 Including Cardano and Solana,XRP
2024-12-01,Cardano’s Hoskinson Calls for Crypto Unity Against Operation Chokepoint 2.0,XRP
2024-12-01,Dogecoin To $3? Expert Says The Countdown Has Begun – Details,XRP
2024-12-01,Memecoins Shiba Inu (SHIB) and Brett (BRETT) Surge Over 20% in Daily Charts. Who is Next?,XRP
2024-12-01,Grayscale’s Crypto Holdings Surge in November Amid Stellar and XRP’s Triple-Digit Gains,XRP
2024-12-02,"Crypto Today: BTC halts at $98K, Microstrategy buys again as XRP, XMR, DASH emerge top gainers",XRP
2024-12-02,XRP’s Meteoric Rise Overshadowed by XLM’s Stunning 483% Surge,XRP
