date,headline,crypto
2024-06-13,Tesla CEO Elon Musk Warns Against Government Overregulation,BTC
2024-06-13,3 Cat-Themed Meme Coins To Sell Amid Red-Zone,BTC
2024-06-13,"Bitcoin, Ethereum, Dogecoin Slip Into Red Zone, But Bitcoin's Struggle To Break Out Is 'Beneficial,' Claims Trader",BTC
2024-06-13,Solana Path To $140 Threshold: Analyst Predicts Major Downswing For SOL,BTC
2024-06-13,Nuffle Labs Raises $13 Million to Expand Modular Infrastructure for Blockchain Layers,BTC
2024-06-14,Circle Executive Says Euro Stablecoins Will Boom After MiCA Goes Live In 2 Weeks,BTC
2024-06-14,Breaking: Deutsche Telekom (T-Mobile) To Dive Into Bitcoin Mining Soon,BTC
2024-06-14,"Bitcoin, Ethereum, Dogecoin Drop Further: 'Chop For Rest Of The Summer…Beggars Can't Be Choosers,' Says Trader",BTC
2024-06-14,Top 3 Meme Coins to Buy As Bitcoin Under $65k Sparks Fresh Correction,BTC
2024-06-14,Polkadot (DOT) Token Utility,BTC
2024-06-15,Toncoin (TON) v Uniswap (UNI): Where Will Bulls Settle?,BTC
2024-06-15,LEAKED: Biden Admin to Attend Bitcoin Roundtable With Key Congressional Officials in DC,BTC
2024-06-15,MicroStrategy Plans $700 Million Bitcoin Purchase,BTC
2024-06-15,"LATAM Crypto Roundup: Itaú Unibanco Launches Cryptocurrency Trading, Bitcoin Pharaoh Remains in Prison, and More",BTC
2024-06-15,"Bitcoin Cash Community Unites for ""Jessica"" Upgrade Event",BTC
2024-06-16,Top Crypto Investment For 2024: BlockDAG Rated #1 Outperforming Fetch.ai & Celestia; Rise Of Layer 1?,BTC
2024-06-16,"Bitcoin uses more renewable energy, but will Tesla accept it again?",BTC
2024-06-16,Missed Pepe and Book of Meme? SolJu could be the next hit,BTC
2024-06-16,Solana Reaches Key Support Amid Bitcoin Decline,BTC
2024-06-16,Uniswap Price Rebounds with 64.25% Increase in Open Interest: What’s Ahead?,BTC
2024-06-17,Hoskinson Reveals Real Reasons Why Cardano Will Flip Bitcoin To Become The World’s Largest Cryptocurrency,BTC
2024-06-17,"Bitcoin, Ethereum, Dogecoin Go Sideways, But 'Market Structure Back To Bullish,' Says Trader",BTC
2024-06-17,CoinShares: Altcoins Defy Trends As Bitcoin Faces $600M in Outflows – What’s Next?,BTC
2024-06-17,"Best Crypto to Buy Now June 17 – Brett, Jasmy, Tron",BTC
2024-06-17,"Shiba Inu’s Shibarium Sees Triple-Digit Surge Across Major Metrics, What’s Going On?",BTC
2024-06-18,Brazil’s tax dept to summon info from foreign crypto exchanges: Report,BTC
2024-06-18,"Bitcoin Tumbles Below $65,000: Should You Panic Or Buy?",BTC
2024-06-18,"Expert Forecasts Altcoin Market Crash, Suggests Optimal Buy-In Points For Top 10 Cryptos",BTC
2024-06-18,"Bitcoin, Ethereum, Dogecoin Print More Red Candles, But Top Trader 'Can't Be Bearish Here'",BTC
2024-06-18,"BitMEX Co-founder Backs Meme Coins: A Boon For Dogecoin, Shiba Inu, PEPE?",BTC
2024-06-19,FOMO HOUR 141 - SEC DROPS ETH PROBE,BTC
2024-06-19,Binance Labs Announces Investment in New Cross-Chain DEX and Bridging Aggregator,BTC
2024-06-19,Solana Down 40% But Analyst Says Now’s The Time To Buy SOL,BTC
2024-06-19,Get Amped with BlockDAG: Crypto Earnings Like Never Before; Calling All GALA & ONDO Traders!,BTC
2024-06-19,Top AI Altcoins To Stack Up As Nvidia Stock Clocks New Market Heights,BTC
2024-06-20,Canada May See First Solana ETF as 3iQ Submits ETP Filing,BTC
2024-06-20,"Crypto rumors spark panic in Korea, Binance airdrops for BNB hodlers: Asia Express",BTC
2024-06-20,3iQ Files to Launch First Solana ETF in Canada,BTC
2024-06-20,‘More Bullish Than Ever’: Circle CEO Explains Why He’s Optimistic About Crypto,BTC
2024-06-20,Trump Gets $2M In Bitcoin Donations For 2024 Election From Winklevoss Twins: 'The Biden Administration Has Openly Declared War Against Crypto',BTC
2024-06-21,"Bitcoin Slips Under $64,000: Here’s Where The Next Support Is",BTC
2024-06-21,"This Is Why Altcoin Investors Struggle Despite Bitcoin, Ether Sitting Near Yearly Highs",BTC
2024-06-21,Bitcoin price drop and crypto market turmoil intensifies — Is Germany to blame?,BTC
2024-06-21,"Mexican Drug Cartels Use Bitcoin, Ethereum, Monero and USDT To Acquire Key Fentanyl Ingredients: US Regulators",BTC
2024-06-21,"Top Trader Says Bitcoin (BTC) at ‘Do-or-Die’ Level, Updates Outlook on Solana (SOL) and dogwifhat (WIF)",BTC
2024-06-22,Chainlink Price Prediction: Will LINK Correction Slip Under $10 By June End?,BTC
2024-06-22,BONK’s Price Recovery Now Sits in the Hands of Bitcoin,BTC
2024-06-22,Messari’s New Report Recognizes Nervos CKB as a Game-Changer for Bitcoin’s Scalability and Programmability,BTC
2024-06-22,4 Altcoins Reigning the Slow Market Week With 10X Gains,BTC
2024-06-22,BtcTurk Hack Triggers Avalanche’s AVAX Decline to 6-Month Low of Under $25,BTC
2024-06-23,Polkadot ($DOT) Tumbles Amid Wider Market Downturns,BTC
2024-06-23,"Market Jitters: Analysts Warn of Looming US Stock Crash, Draw Parallels to 1929",BTC
2024-06-23,Bitcoin targets $90K on high time frame bullish signals,BTC
2024-06-23,Crypto’s Stagnant Summer: Analysts Say ‘Boring’ Markets May Set Stage for Eventual Price Surge,BTC
2024-06-23,"Bitcoin price loses ground as TON, PEPE, KAS and JASMY catch traders’ attention",BTC
2024-06-24,Solana Price Braces For Potential Crash Below $100 Amid Investigation Rumors,BTC
2024-06-24,Shiba Inu Enters Accumulation Zone Amid 493% In Shibarium Transaction Fees,BTC
2024-06-24,"Bitcoin Plunges Below $60K, Ethereum, Dogecoin Follow Dwon, But...'July Is Historically Bullish,' Says Trader",BTC
2024-06-24,True Correction Underway? Over $500 Million Exits Bitcoin ETFs — Coinshares,BTC
2024-06-24,Mt. Gox Trustee Announces Definitive Date For Bitcoin And BCH Repayments,BTC
2024-06-25,Solana Eyes $200 Rebound As New Adoption-Driving Technology Debuts,BTC
2024-06-25,FOMO HOUR 145 - WE SURVIVED!,BTC
2024-06-25,White House Rehires Adviser Who Helped Develop Biden’s Executive Order on Crypto,BTC
2024-06-25,Fear and greed: Crypto market in trouble? Bitcoin’s plunge raises concerns,BTC
2024-06-25,"Pundit Is Undeterred By The Solana Price Crash, Says Price Is Headed For $1,000",BTC
2024-06-26,Ripple CEO Blasts SEC Chair’s Crypto Remarks — Says ‘Gensler Will Cause Biden to Lose the Election’,BTC
2024-06-26,"Bitcoin RSI Signals Buying Opportunity for Altcoins, Says Crypto Analyst",BTC
2024-06-26,Bitcoin miner Marathon Digital is mining Kaspa (KAS),BTC
2024-06-26,"Top 5 Memecoins by Market Cap: $DOGE, $SHIB, $PEPE, $WIF and $FLOKI",BTC
2024-06-26,"Bitcoin, Ethereum, Dogecoin Bottom Out As US Government Wallet Sends $240M BTC To Coinbase",BTC
2024-06-27,SOL Price Soars As First-Ever Solana ETF Filing Surfaces In The US,BTC
2024-06-27,"Best Crypto to Buy Now June 27 – Kaspa, Injective, Toncoin",BTC
2024-06-27,Telegram-Based Notcoin Burns 210 Million Tokens Amid Positive Recovery,BTC
2024-06-27,"Bitcoin, Ethereum, Dogecoin Rally, VanEck Files Solana ETF Application, But... 'Don't Get Too Excited Yet,' Warns Trader",BTC
2024-06-27,Chainlink Data Streams Activate on Avalanche Blockchain With GMX Integration,BTC
2024-06-28,"Crypto Trader Says He’s ‘Extremely Long’ On Ethereum, Undeterred By Crash Below $3,400",BTC
2024-06-28,"Florida Man Convicted for Violent Kidnapping, Assault and Crypto-Stealing Scheme",BTC
2024-06-28,"Solana (SOL) Surges 18%, But Watch Out For Crowd FOMO",BTC
2024-06-28,Dogwifhat Price Analysis: WIF Eyes $3 as Whales Ramp Up Purchases,BTC
2024-06-28,"Solana ETF Approval Could Skyrocket SOL’s Value 9x Higher, Report Finds",BTC
2024-06-29,Mog coin (MOG) Records Massive Activity Defying Markets,BTC
2024-06-29,Court Dismisses SEC Claim on Secondary Sales of BNB,BTC
2024-06-29,Meme coins have an important role to play in crypto,BTC
2024-06-29,Mog Blends Meme Culture with Cryptocurrency Success,BTC
2024-06-29,"Spot Ether ETF Approval Expected to Enhance Crypto Asset’s Legitimacy and Utility, Says Hedera Council President",BTC
2024-06-30,The Definitive Guide to Tapioca DAO: Part Two,BTC
2024-06-30,Arkham Calculates Vitalik Buterin’s Latest Net Worth,BTC
2024-06-30,"Bitcoin price recovery to $62.5K could trigger breakout in TON, AVAX, KAS and XMR",BTC
2024-06-30,Polkadot Price Analysis: $DOT Up 8% Over the Past 7 Days,BTC
2024-06-30,BONK Price Returns to Consolidation Amid Growing Optimism,BTC
2024-07-01,Bitcoin Analyst Says Coin Overvalued: Why Is This BTC Chart Super Bullish?,BTC
2024-07-01,New Crypto Regulation: Firms In Hawaii Now Exempt From MT License Requirement,BTC
2024-07-01,Baked Or Burned? Trader Makes 307x From Solana Token But Investors Raise The Alarm,BTC
2024-07-01,"Bitcoin, Ethereum, Dogecoin Start July In The Green: 'Still In A Bull Cycle, Boring Is An Opportunity,' Says Trader",BTC
2024-07-01,"Best Crypto to Buy Now July 1 – Ethereum, ENS, Dogwifhat",BTC
2024-07-02,PEPE Bullish Signal: Whale Withdraws $14.7 Million Stack From Binance,BTC
2024-07-02,Trump’s 2024 Election Odds Jump to 66% on Polymarket; GOP Expected to Control Congress,BTC
2024-07-02,Toncoin (TON) v Cardano (ADA): On-chain Data Show Gains,BTC
2024-07-02,Bullish Reversal For Bitcoin? Retail Investors Flood Back As New Addresses Reach 4-Month Peak,BTC
2024-07-02,"Bitcoin, Ethereum, Dogecoin Reverse Gains: 'Another Boring Day On Bitcoin,' Says Trader",BTC
2024-07-03,"Bitcoin Falters To $60K, Threatening To Crash Ether, Solana, XRP, Dogecoin, Shiba Inu Prices Harder",BTC
2024-07-03,"These Are The Altcoins In Buy Zone, Analytics Firm Reveals",BTC
2024-07-03,Toncoin outshines top 50 tokens with over 40% rise in Q2 2024,BTC
2024-07-03,"Bitcoin Cash Network Sees Record Hash Rate Spike, But Price Dips",BTC
2024-07-03,Is Bittensor Safe? Network Halted After $8 Million Vanishes From Security Breach,BTC
2024-07-04,"Bitcoin’s (BTC) Price Slips Below $60,000 – Time for Altcoin Season",BTC
2024-07-04,"German Government Still Holds Over 40K Bitcoins After Recent Sale, Onchain Data Shows",BTC
2024-07-04,"Phoenix BCH Miner Elevates Hashrate to New Highs, Raising Concerns Within the Community",BTC
2024-07-04,Is Cardano the Next Big Winner? Analysts Predict Massive Surge as Bitcoin Wobbles,BTC
2024-07-04,"Bitcoin price falls to 2-month low, but derivatives markets reflect traders’ interest",BTC
2024-07-05,Analyst: Mt Gox Repayment Event Will Cause 4x the Selling Pressure for BCH Compared to BTC,BTC
2024-07-05,XRP Faces Continuous Decline Despite Legal Clarity,BTC
2024-07-05,dogwifhat vs Popcat: Perspectives of Two Bullish Assets Amid Crypto Crash,BTC
2024-07-05,Tron Founder Justin Sun Wants to Buy German Government’s Bitcoin Stash,BTC
2024-07-05,Prominent Hedge Fund Exec Blasts Cardano And XRP As “Cult Meme Coins”,BTC
2024-07-06,Justin Sun ridicules Germany’s Bitcoin sell-off after UEFA Euro knockout,BTC
2024-07-06,"Bitcoin Woes Not Over? Analyst Predicts Further Crash To $47,000",BTC
2024-07-06,Bitcoin Proponent Bruce Fenton Calls Out Jack Dorsey Over Censorship Allegations During Twitter Tenure,BTC
2024-07-06,Bitcoin Price Prediction as Traders Bet on Trump’s Return – How High Can BTC Go?,BTC
2024-07-06,NFT Sales Rise 8% Higher Amid Broader Crypto Market Downturn,BTC
2024-07-07,Interesting List: Top 10 Cryptocurrencies by 1-Year Fee Revenue (Analysis),BTC
2024-07-07,Shiba Inu Price Analysis: Will SHIB Price Reclaim $0.00003 Mark By July End?,BTC
2024-07-07,"Bitcoin recovery fizzles, but SOL, DOT, NEAR and KAS could rally",BTC
2024-07-07,"Shiba Inu Whales On The Move Again As Bitcoin, Crypto Market Recover",BTC
2024-07-07,Polkadot Price Analysis: $DOT Tumbles Amid Treasury Spending Concerns,BTC
2024-07-08,"After BTC and ETH, Solana ETF is Finally Launching!",BTC
2024-07-08,FOMO HOUR 153 - A WEAK WEEKEND,BTC
2024-07-08,XRP Price: Crypto Analyst Identifies ‘Point Of Control’ That Could See A Repeat Of 2017,BTC
2024-07-08,"Analyst Predicts ChainLink (LINK) Rally To $13 Could Result In 45% Price Correction, Here’s Why",BTC
2024-07-08,RWA is the best-performing crypto sector in Q2: Artemis data,BTC
2024-07-09,"Bitcoin Approaching $60,000: Analyst Thinks BTC Is Ready To Fly, Here’s Why",BTC
2024-07-09,Bitcoin Now Forming Pattern That Last Led To It Blasting Off,BTC
2024-07-09,Crypto Whales Buy The Dip As $22 Million In XRP Flows Out Of Binance,BTC
2024-07-09,Blackrock’s BUIDL Fund Reaches $500M Milestone; Tokenized Treasuries Tap $1.8B,BTC
2024-07-09,3 Mid-Cap Cryptos to Buy if Market Correction Bottoms,BTC
2024-07-10,Here’s A Look Inside Germany’s Billion-Dollar Bitcoin Holdings And Why It Has Been Selling,BTC
2024-07-10,"Bitcoin to $250K, Solana to $800 in 2025? IF these conditions are met",BTC
2024-07-10,Here’s How Much Bitcoin (BTC) Drake Lost After Argentina Qualified for Copa America’s Final,BTC
2024-07-10,How CFTC Illinois Case Strengthens Calls For Crypto as Commodities,BTC
2024-07-10,Is This The Perfect Time To Buy Bitcoin? Here’s What History Says,BTC
2024-07-11,Greenidge Generation expands Bitcoin mining in Mississippi,BTC
2024-07-11,US CPI Data: Gold and Crypto Markets Expect Upswing,BTC
2024-07-11,JPMorgan Expects Crypto Market Recovery Beginning in August,BTC
2024-07-11,"As Bitcoin [BTC] dominance drops below 55%, is altcoin season here?",BTC
2024-07-11,"Solana Price Tipped For Explosive 1,800% Rally, Analyst Foresees $2,800 Price Target",BTC
2024-07-12,CME Group Adds XRP to Crypto Benchmarks,BTC
2024-07-12,It’s Over: The German Government Has Run Out Of Bitcoin,BTC
2024-07-12,Germany runs out of Bitcoin after 23 days of selling,BTC
2024-07-12,"House Fails to Overturn Biden’s Veto on Crypto Custody Guidance, SEC Offers New Path",BTC
2024-07-12,"German Government Resumes Bitcoin Selling Spree, Currently Holding Less Than 4,000 BTC",BTC
2024-07-13,"Crypto Analyst Says Bitcoin Price Will Surge 500% To $330,000, Here’s When",BTC
2024-07-13,Elon Musk Exposes Secret EU Censorship Deal Proposal,BTC
2024-07-13,Abra Acquires Valkyrie’s Tron and Zilliqa Trusts,BTC
2024-07-13,Bitcoin futures term structure indicates bullish sentiment,BTC
2024-07-13,Stacks Celebrates as SEC Ceases Investigation Efforts,BTC
2024-07-14,"Did AT&T Pay $400,000 In Bitcoin To Data Hackers?",BTC
2024-07-14,Donald Trump is Determined! Full Support Statement for Bitcoin!,BTC
2024-07-14,Privacy Coin Monero Tops Payments at European Online Retailer Shopinbit in June,BTC
2024-07-14,Bitcoin Cash (BCH) Inches Closer to $700 Whilst Clandeno (CLD)ICO Secures Major Funding from Cardano (ADA) Investor,BTC
2024-07-14,Trump’s Crypto Pivot Wins Over 13% of Formerly Skeptical Republican Voters: Paradigm Poll,BTC
2024-07-15,"Bitcoin, Ethereum, Dogecoin Continue Their Green Streak, But 'Big Test' Could Come On A $60K Retest",BTC
2024-07-15,Bitcoin Price Recovery Above $63K Fuels Rally in These 5 Cryptos,BTC
2024-07-15,"Bitcoin weekly funding rate reflects investor caution, yet BTC price pushes higher",BTC
2024-07-15,"Solana Dominating Ethereum: SOL Analyst Now Targets $1,000",BTC
2024-07-15,"'Trump Trade' explained, Trump Media and Bitcoin rise, BlackRock's old ad: Trump news roundup",BTC
2024-07-16,"Bitcoin, Ethereum Rising: Analyst Explains Why The Next Bull Run Will Be “Crazier”?",BTC
2024-07-16,"Bitcoin, Ethereum, Dogecoin Continue Collecting Gains: 'If History Repeats, September/October Will Be Explosive,' Says Expert",BTC
2024-07-16,Hermetica Introduces Bitcoin-Backed Synthetic Dollar on Bitcoin L1,BTC
2024-07-16,"Terra Luna Classic Votes On Key Proposal, LUNC Revival Happening?",BTC
2024-07-16,"$301M Flows Into Bitcoin ETFs, Led by Blackrock and Ark Invest",BTC
2024-07-17,Altcoin Season Looms as 18 Top Cryptos Outshine Bitcoin,BTC
2024-07-17,"Bitcoin, Ethereum, Dogecoin Dip: BTC 'Not Ready' For The $65K Retest, Trader Points Out",BTC
2024-07-17,Vitalik Vs. Trump Donors: Ethereum Co-Founder Says He's 'Against Choosing Your Political Allegiances Based On Who Is Pro-Crypto',BTC
2024-07-17,Total Liquidity Pledge to HTX DAO Hits $42.5M After 2nd Round – Bolstering Decentralized Ecosystem,BTC
2024-07-17,Understanding Token Unlocks: How Supply Changes Affect Market Dynamics,BTC
2024-07-18,NEAR Surges 20%: Pantera Capital MP Reveals 5 Reasons For Bullish Outlook,BTC
2024-07-18,"Bitcoin, Ethereum, Dogecoin Trade Lower, But 'August Will Be Great' If Bitcoin Holds On To This Key Level",BTC
2024-07-18,"DeFi Technologies (DEFTF) Buys Another $6 Million in Bitcoin, Doubles BTC Holdings",BTC
2024-07-18,Indian Crypto Exchange Wazirx Updates on Major Multisig Wallet Hack,BTC
2024-07-18,Donald Trump Presidential Campaign Is Now Adding More Hype to Bitcoin Than Ever Before,BTC
2024-07-19,Can Burns Send The Shiba Inu And LUNC Price To $0.01? Expert Chimes In,BTC
2024-07-19,Trump and Bitcoin: How Institutional Bets on $100K December Calls Could Shape the Market,BTC
2024-07-19,"Bitcoin, Ethereum, Dogecoin Enter The Weekend With Big Gains: 'Sunday Report Will Make You All Happy,' Trader Touts",BTC
2024-07-19,Momint Secures Grant from Dfinity Foundation for Global Blockchain Expansion,BTC
2024-07-19,Internet Computer Price To Tag $17 On 77% Bitcoin-Driven Rally,BTC
2024-07-20,Bitcoin Option Traders Are Betting On A Price Breakout Ahead Of US Elections: QCP Capital,BTC
2024-07-20,"Solana Breaks $170, Outperforming Bitcoin and Ethereum",BTC
2024-07-20,Bitcoin Now In French Pension Plans!,BTC
2024-07-20,"LATAM Crypto Roundup: ICP Pilots Bitcoin Payments in Mexico, Paraguayan Miners Move to Brazil, and More",BTC
2024-07-20,Wazirx Prepares Bounty Program to Recover $230 Million Stolen in Security Breach,BTC
2024-07-21,Trump's RNC speech gave tech enthusiasts hope for the future,BTC
2024-07-21,Bitcoin as National Asset,BTC
2024-07-21,"Bitcoin Indicator Pointing Towards ‘Deep Value’ for BTC, According to ARK Invest Analysts",BTC
2024-07-21,"Bitcoin price advance toward $68K sets a bullish path for SOL, ICP, GRT and BONK",BTC
2024-07-21,"BREAKING: Elon Musk Allegedly to Speak at Bitcoin Conference! He Changed His Profile Photo, His Plane Landed in Tennessee!",BTC
2024-07-22,Solana Cooling Off After 16% Surge? TD Sell Signal Goes Off,BTC
2024-07-22,Short Bitcoin ETFs Take a Hit With $1.9M in Outflows: Are Bears Losing Their Grip?,BTC
2024-07-22,"Polygon Network Active Addresses Just Hit A New Yearly High, But Why Is MATIC Price Down?",BTC
2024-07-22,"Bitcoin, Ethereum Flat, But Dogecoin Spikes: 'Veteran Holders Are Not Selling Bitcoin,' Analyst Highlights",BTC
2024-07-22,TON Blockchain Partners with Mocaverse; Whats Next?,BTC
2024-07-23,"Cosmos (ATOM) Set For 50% Rally After Recent Plunge, Analyst Eyes $12 Target",BTC
2024-07-23,"Best Crypto to Buy Today – Ethereum Name Services, Helium, Pepe",BTC
2024-07-23,Senator Cynthia Lummis releases report attacking Biden’s mining tax,BTC
2024-07-23,Mt. Gox Creditors Begin Withdrawing Owed Bitcoin And BCH Funds Via Kraken,BTC
2024-07-23,Kamala Harris is catching up on crypto as she runs against Donald Trump,BTC
2024-07-24,"Hashdex files S-1 for ETF to hold Bitcoin, Ether and potentially others",BTC
2024-07-24,Kraken Completes Mt Gox Bitcoin and Bitcoin Cash Distribution to Creditors,BTC
2024-07-24,Will PEPE Climb 30% This Week? This Analyst Thinks So,BTC
2024-07-24,Bitcoin traders back in profit even as price slows alongside spot BTC ETF inflows,BTC
2024-07-24,"Bitcoin, Ethereum, Dogecoin Trade In A Mixed Bag, Analyst Marks $66,000 As Crucial Support Level Ahead Of New All-Time Highs",BTC
2024-07-25,"Cardano Among Alts Likely To See Price Boosts, Santiment Says",BTC
2024-07-25,US Bitcoin ETFs Draw $44.51M in Inflows; GBTC Sees Another Round of Outflows,BTC
2024-07-25,"Whale With Ethereum Foundation Link Transfers 92,500 ETH Worth $288M",BTC
2024-07-25,"Bitcoin, Ethereum, Dogecoin Feel The Pressure: $60.5K-$62K Is A 'Must-Hold,' But The End Of 'Mini-Correction' Is Drawing Near, Trader Says",BTC
2024-07-25,Kraken Has Successfully Distributed Bitcoin (BTC) and Bitcoin Cash (BCH) to Mt Gox Creditors: CEO David Ripley,BTC
2024-07-26,Bitcoin ETFs Added To Michigan State Pension Fund With $6.6 Million Allocation,BTC
2024-07-26,U.S. presidential candidate Robert F. Kennedy Jr. promises to issue Bitcoin-related executive orders if elected,BTC
2024-07-26,"HTX Ex-Employees Sentenced to 3 Years for Stealing 27,000 Mnemonics and 10,000 User Private Keys",BTC
2024-07-26,Michigan’s Pension Fund Dives into Bitcoin: A Bold Move into the Crypto World,BTC
2024-07-26,"SEC approves Grayscale Bitcoin Mini Trust, awaiting registration statement greenlight",BTC
2024-07-27,Cardano Recovery Imminent? Whales Make Their Move With 17 Billion ADA,BTC
2024-07-27,Sen. Lummis proposes US government purchase 5% of total Bitcoin supply,BTC
2024-07-27,Cardano’s Node 9.1.0 Marks Final Step Before Chang Hard Fork and Voltaire Launch,BTC
2024-07-27,Europol Claims That Bitcoin Remains Top Choice for Criminals,BTC
2024-07-27,Trump says he’ll fire SEC Chair Gensler and create strategic bitcoin reserve if elected: Bitcoin 2024,BTC
2024-07-28,Syscoin execs accused of unauthorized creation of 100 million new SYS tokens,BTC
2024-07-28,Hong Kong Considers Adding Bitcoin to Financial Reserves,BTC
2024-07-28,"Bitcoin’s price rally to $70K could lure buyers to XRP, KAS, STX and JASMY",BTC
2024-07-28,Scaramucci: 'I Agree With Every Single Thing' Trump Has Said On Bitcoin,BTC
2024-07-28,"Wazirx Clarifies Recovery Options, Asset Valuation, and USDT Conversion After Cyberattack",BTC
2024-07-29,All-Time Highs Ahead? Dogwifhat (WIF) Poised For Big Growth — Analyst,BTC
2024-07-29,"Cryptocurrencies to watch in August: Poodlana, Bitcoin, BOOK OF MEME (BOME)",BTC
2024-07-29,"Bitcoin, Ethereum, And Solana On Traders’ Radar: What’s Going On?",BTC
2024-07-29,"Best Crypto to Buy Now – BSV, Book of Meme, AIOZ Network",BTC
2024-07-29,"US Authorities Split $2 Billion in Bitcoin Into 2 Wallets, Igniting Custody and Sale Speculation",BTC
2024-07-30,"Best Crypto to Buy Now July 30 – Book of Meme, MOG Coin, AIOZ Network",BTC
2024-07-30,Sen. Lummis draft bill allows US states to hold bitcoin,BTC
2024-07-30,NEAR Protocol Price Targets $8 Comeback as Active Addresses Hit ATH,BTC
2024-07-30,SEC Charges Bitclout Founder With Multi-Million-Dollar Crypto Fraud,BTC
2024-07-30,Trump campaign raises $21M during Bitcoin 2024 conference,BTC
2024-07-31,"Which Crypto to Buy Today 31 July – Beam, Mog Coin, Aave",BTC
2024-07-31,Bitcoin Tumbles Below $65K Post-FOMC as Middle East Tensions Flare,BTC
2024-07-31,"Bitcoin, Ethereum, Dogecoin Labor Sideways: Trader Eyes $64K As Support If BTC Dumps",BTC
2024-07-31,"Market Volatility Surges Amid Global Uncertainty, Says QCP Capital",BTC
2024-07-31,Pendle Price Sees Major Reversal Amid Institutional Buying Spree,BTC
2024-08-01,"Bitcoin, Ethereum, Dogecoin Move Lower Ahead Of Crypto Options Expiry: 'Bears Are Getting Cocky,' Analyst Says",BTC
2024-08-01,"Smart trader made $15.62 million in PEPE and MOG, Here’s How",BTC
2024-08-01,Analyst Says XRP on Cusp of Bullish Breakout if It Can Break Through This Major Resistance Level,BTC
2024-08-01,Bitcoin Cash Falls More Than 8% In 24 hours,BTC
2024-08-01,Cathie Wood’s ARK Invest Sells More Coinbase Stock as Crypto Markets Nosedive,BTC
2024-08-02,Kamala Harris Reps to Meet Crypto Industry Leaders on Monday,BTC
2024-08-02,"Bitcoin, Ethereum, Dogecoin Dump: 'We Should Be Back In Line By October,' Says Expert",BTC
2024-08-02,"Large-Cap Ethereum Rival Forming a Bullish Pattern That Could See It Surge by up to 63%, Says Crypto Trader",BTC
2024-08-02,Terra Classic Price Set To Reach $0.0001 But LUNC May Flip Bearish After,BTC
2024-08-02,Base TVL Up $11 Million After Coinbase Q2 Earnings,BTC
2024-08-03,"Experts Say BTC Will Stay Over $60,000 and Possibly Hit All-Time High Price Next 3 Month – Top 5 Altcoins to Invest Before the Bull Run",BTC
2024-08-03,Morgan Stanley’s Wealth Advisors to Offer Bitcoin ETFs,BTC
2024-08-03,AAVE and Curve DAO Price Show Strength in Sea of Red,BTC
2024-08-03,"Crypto Analyst Says Ethereum-Based Altcoin To Go Much Higher, Updates Outlook on Bitcoin and dogwifhat",BTC
2024-08-03,"Top Crypto to Invest In Today August 2 – Bitcoin (BTC), Solana (SOL), Near Protocol (NEAR)",BTC
2024-08-04,Binance Coin In Turmoil: Nearly 10% Value Erased In Market Shake-Up,BTC
2024-08-04,ZKX Shutdown: Amber Group Slams the Protocol’s Lack of Transparency,BTC
2024-08-04,"Bitcoin falls into demand zone — Will SOL, XRP, KAS and AAVE follow?",BTC
2024-08-04,"Crypto Market Liquidations Top $197 Million As Bitcoin Price Plunges Below $60,000",BTC
2024-08-04,US Senate Advances Bill to Make Bitcoin a Strategic Reserve,BTC
2024-08-05,"Bloody Monday: Cardano Not Spared From Bloodbath, Suffers 30% Loss",BTC
2024-08-05,"Bitcoin, Ethereum, Dogecoin See Bloodbath, Liquidations Cross $1B: -25% In 10 Days Happened 45 Times Since 2015—What's Next?",BTC
2024-08-05,Caitlyn Jenner Introduces Olympic Gold Medal Inspired Token on Base,BTC
2024-08-05,"Peter Schiff Mocks Bitcoin Crash: ""HODLers Are in Denial""",BTC
2024-08-05,Crypto Investment Products Saw Outflows of $528M Weekly as US Recession Fears Grow: CoinShares,BTC
2024-08-06,Bitcoin Price Plunge Triggers Largest Long Position Liquidation In Months,BTC
2024-08-06,MyStake Hosts 2024 Summer Olympic Games Leaderboard,BTC
2024-08-06,"Bitcoin, Ethereum, Dogecoin Recover: '$60K Would Start Looking Interesting,' Says Veteran Trader",BTC
2024-08-06,Trump and Lummis have pushed for US bitcoin reserves but critics express doubts,BTC
2024-08-06,Stablecoin Market Sees PYUSD Supply Swell While USDE Shrinks With Redemptions,BTC
2024-08-07,10 Altcoins Analyst Says Are Safe in Market Jitters,BTC
2024-08-07,"BREAKING: Ripple Concludes SEC Battle With $125M Penalty, XRP Price Skyrockets",BTC
2024-08-07,Polkadot Price Hits Multi-Year Support in Oversold State; Rebound Imminent?,BTC
2024-08-07,Bitcoin Funding Rates Turn Negative: Shorts’ Turn To Get Squeezed?,BTC
2024-08-07,"Ethena Labs Expands USDE to Solana, Reveals Gradual SOL Integration",BTC
2024-08-08,"Top Crypto Performers Today – Sui, Helium, Bittensor",BTC
2024-08-08,Bitcoin SV: Altcoin Boasts 10% Gains As Rest Of The Market Falters – Details,BTC
