date,headline,crypto
2025-01-18,"GameGPT Launches The Revolutionary Genesis AI NFT Collection, Combining AI and Blockchain for the Future of Gaming",BTC
2025-01-18,"Bitcoin Reenters $105,000 Territory Amid Mounting Excitement For New Crypto-Friendly Era Ahead Of Trump’s Inauguration",BTC
2025-01-18,"Analyst Says Top Ethereum Rival Is Starting To ‘Look Good Again,’ Outlines Path Forward for Bitcoin and Stacks",BTC
2025-01-18,Coinbase Launches Bitcoin-Backed Loans via Morpho,BTC
2025-01-18,Cardano Price To $6? Historical Data Says ADA Is Ready To Take Off,BTC
2025-01-19,"Bitcoin is down more than $6,000 in minutes and briefly below $100,000

DOG candle... 🤨",BTC
2025-01-19,SEC Targets Nova Labs for Alleged False Claims About Helium Partnerships,BTC
2025-01-19,Coinbase Sees Rising Altcoin Interest As Traders Prepare For Big Moves,BTC
2025-01-19,"Bitcoin about to make the highest weekly close EVER!

Less than $400 away from making history...",BTC
2025-01-19,Official Trump memecoin captures crypto market trading volume as Bitcoin prepares for new highs,BTC
2025-01-20,"Will Ethereum Price Rally Past $7,000? Experts Point To This Bullish Pattern",BTC
2025-01-20,World Liberty Financial Adds $47 Million in Wrapped Bitcoin Amid Trump Inauguration,BTC
2025-01-20,🇺🇸 BREAKING: Trump appoints pro-Bitcoin Mark Uyeda to replace Gary Gensler as Chair of the SEC,BTC
2025-01-20,World Liberty Financial Makes Huge Crypto Buy Post Inauguration – Is Trump Buying These?,BTC
2025-01-20,Trump’s WLF buys $47 million Bitcoin immediately after his swear-in,BTC
2025-01-21,MicroStrategy Shareholders Vote To Increase Number of Shares in Order To Fund Bitcoin (BTC) Purchases,BTC
2025-01-21,"Big Players Bet Big On XRP, Solana With Excitement Around Donald Trump’s Presidency, Here Are The Figures",BTC
2025-01-21,"WLFI Pushes Chainlink 30% Higher, Cardano Partnership Hints Add Fuel",BTC
2025-01-21,Peter Schiff Lambasts Bitcoin as ‘Meme Coin’,BTC
2025-01-21,2 cryptocurrencies to reach a $10 billion market cap in Q1 2025,BTC
2025-01-22,Bitwise Applies for Dogecoin ETF with Delaware Trust Filing,BTC
2025-01-22,Coinbase files to dismiss BiT Global lawsuit over wBTC,BTC
2025-01-22,"The Daily: Trump frees Ross Ulbricht, Jupiter airdrops $600 million in JUP tokens and more",BTC
2025-01-22,Trump-endorsed World Liberty Financial buys Justin Sun tokens,BTC
2025-01-22,Why Worldcoin (WLD) Price is Surging? Will it Achieve a 30% Rise This Week?,BTC
2025-01-23,SEC Revokes SAB 121 Policy Allowing Banks to Custody Crypto,BTC
2025-01-23,"Yesterday Bank of America’s CEO said Wall Street is ready to “come in hard” for Bitcoin and crypto if the regulators allow them.

The regulator just gave the green light! 

🟢🟢🟢",BTC
2025-01-23,President Trump signs an executive order for a national Bitcoin strategic reserve,BTC
2025-01-23,Presidents will be talking about how to adopt crypto soon – Trump to have a call with El Salvador’s Nayib Bukele,BTC
2025-01-23,Justin Sun Says WBTC Is US National Bitcoin Reserve in Name,BTC
2025-01-24,"Bitcoin, Ethereum, XRP, Dogecoin Edge Higher, Weekend 'Pump' Hinges On Daily Close, Trader Says",BTC
2025-01-24,"Cathie Wood Dismisses Trump Meme Coin, Remains Focused On Bitcoin, Ethereum, Solana",BTC
2025-01-24,Will XRP Join Bitcoin in Trump’s US Strategic Crypto Reserve?,BTC
2025-01-24,"Ethereum (ETH) and MultiversX (EGLD) Predicted Trend Reversal, While Monsta Mash ($MASH) Gains Momentum After Hitting $1M In Presale",BTC
2025-01-24,"Bitcoin (BTC) Price Stays Above $105,000 Despite One-Year Low in Whale Numbers",BTC
2025-01-25,Biggest Altcoin Gainers Of The Fourth Week of January 2025,BTC
2025-01-25,BlackRock Ethereum Holdings Surpass 1.2 Million ETH Amidst Strong Institutional Adoption – Details,BTC
2025-01-25,Bitcoin Giant Microstrategy Caught in Biden’s Tax Web,BTC
2025-01-25,Still Waiting For An Altcoin Season? These Metrics Show Why It Might Never Happen,BTC
2025-01-25,io.net Teams Up With Nexus to Enhance Compute Power,BTC
2025-01-26,Russia’s Biggest Energy Provider Rosseti to Launch Crypto Mining Operations,BTC
2025-01-26,"Ripple Undermining U.S. Prosperity, Bitcoin Reserve: Jack Mallers",BTC
2025-01-26,Jupiter Acquires Moonshot to Expand Memecoin Capabilities,BTC
2025-01-26,Crypto Czar David Sacks Labels NFTs Memecoins Collectibles,BTC
2025-01-26,"SOL, LINK, OM, and RAY flash bullish signs as Bitcoin traders wait for BTC’s next move",BTC
2025-01-27,"Cathie Wood Passes On Trump Meme Coin, Poll Shows Investors Split With 58% Saying This",BTC
2025-01-27,21Shares files in-kind redemption proposal for Bitcoin and Ethereum ETFs,BTC
2025-01-27,"Bitcoin, Ethereum, XRP, Dogecoin Drop, Trader Predicts BTC Could Retest $73,000 If 2025 'Mirrors 2017'",BTC
2025-01-27,"Price analysis 1/27: SPX, DXY, BTC, ETH, XRP, SOL, BNB, DOGE, ADA, LINK",BTC
2025-01-27,3 Altcoins That Reached All-Time Low Today — January 27,BTC
2025-01-28,Is Ripple 'Undermining' Strategic Bitcoin Reserve Plans? Here’s What’s Going On,BTC
2025-01-28,"RAY DALIO: The ideal hedge against currency debasement is international, mobile, private, and secure from government confiscation - All-In Pod

...it's called Bitcoin! ",BTC
2025-01-28,RAY DALIO: I own some Bitcoin as a diversified.,BTC
2025-01-28," Bitcoin Price Predictions: The Future of Crypto
🟢 By 2025:
Cathie Wood (ARK Invest): Predicts BTC could hit $500K, driven by institutional adoption and scarcity​
Standard Chartered: $250K forecast, fueled by ETF inflows and the 2024 halving​
Finder Panel: Sees BTC…",BTC
2025-01-28,"Ripple CTO Shuts Down Debate About XRP Centralization, MicroStrategy Announces $1.1 Billion Bitcoin Purchase, XLM and SHIB Get Prime USDC Listings: Crypto News Digest by U.Today",BTC
2025-01-29,Texas Lieutenant Governor Calls Bitcoin Reserve a “Top Priority” for 2025,BTC
2025-01-29,Tesla Benefits from New Accounting Rule for Digital Assets,BTC
2025-01-29,Texas Lt. Governor announces ‘Bitcoin Reserve’ as priority bill for 2025,BTC
2025-01-29,"JUST IN: Tesla confirms it did NOT sell any #Bitcoin in Q4, 2024",BTC
2025-01-29,"JUST IN: 🇺🇸 Senator Menendez who fought against El Salvador adopting Bitcoin was just sentenced to 11 years in prison for taking bribes in Gold and Cash!

What a pity! ",BTC
2025-01-30,US SEC approves Bitwise’s combined Bitcoin and Ethereum ETF,BTC
2025-01-30,Alchemy Pay Expands Access to $MOVE Token Through Fiat On-Ramp Integration,BTC
2025-01-30,"Bitcoin, Ethereum, XRP, Dogecoin Gain Momentum Ahead Of Weekend As Bulls Eye Profitable February",BTC
2025-01-30,"BCH Miner Bitcoin Cloud Mining Contracts Promises Up To $9,999 Daily Profits",BTC
2025-01-30,Ross Ulbricht Loses $12 Million on Pump.fun Due to Liquidity Error,BTC
2025-01-31,"MicroStrategy's $STRK Offering Oversubscribed Nearly 3x, Raises $584 Million to Buy 5,571 Bitcoin",BTC
2025-01-31,"Bitcoin, XRP, Dogecoin Pull Back On Trump Tariff Announcement, Ethereum Hanging On",BTC
2025-01-31,"This Dogecoin and Shiba Inu Rival Is Mirroring Price Action That Previously Triggered 200% Rally, Says Trader",BTC
2025-01-31,MicroStrategy Is Raising $584 Million to Stack Even More Bitcoin,BTC
2025-01-31,"Price analysis 1/31: BTC, ETH, XRP, SOL, BNB, DOGE, ADA, LINK, AVAX, XLM",BTC
2025-02-01,"ETH Outperforms, Gold hits ATH, Saylor on Forbes cover",BTC
2025-02-01,Analyst Forecasts Mammoth 200% Surge for This Dogecoin and Shiba Inu Competitor,BTC
2025-02-01,ZachXBT Reveals Coinbase Users Lost $150 million in Social Engineering Scams,BTC
2025-02-01,AVAX Price Continues To Consolidate Around $35 — Here Are The Levels To Watch,BTC
2025-02-01,"JUST IN: 🇸🇻 El Salvador buys 5 Bitcoin in 24 hours. 

That's 50 Bitcoin in the last 30 days. T

TOTAL: 6,055 BTC worth $617m",BTC
2025-02-02,Trump&#039;s trade war will send BTC price &#039;violently higher&#039; — analyst,BTC
2025-02-02,Chainlink (LINK) Set For $36? Whale Moves Suggest A Big Rally—Analyst,BTC
2025-02-02,US lawmakers raise concerns about the national security risks of Elon Musk’s D.O.G.E,BTC
2025-02-02,"Bitcoin falls to $96.8K as Trump tariffs spook markets: OM, XMR, MNT, GT show promise",BTC
2025-02-02,"Vitalik Buterin Rejects Bitcoin Allocation Rule, Stays Committed to Ethereum",BTC
2025-02-03,Is the Bitcoin bottom in? BTC derivatives point to limited price downside,BTC
2025-02-03,‘We Are Not Selling’: Trump-Linked DeFi Project Addresses $250M in Ethereum Token Moves,BTC
2025-02-03,Solana Retraces TRUMP Meme Pump Gains – But Technicals Suggest A $300 Run,BTC
2025-02-03,Texas Tempts Meta,BTC
2025-02-03,Trump-backed World Liberty Financial denies token sales,BTC
2025-02-04,"Bitcoin, XRP, Dogecoin Dip, Ethereum Holds Steady As Crypto Market Consolidates",BTC
2025-02-04,"As Bitcoin Dominance Falls, Here Are 4 Tokens Priced Below $1 That Could 20x In 2025",BTC
2025-02-04,"BTC volatility hits record low, stablecoin transaction value tops Visa — ARK",BTC
2025-02-04,Ark Invest Says Bitcoin on Track to Meet 2030 Price Target,BTC
2025-02-04,"Ethereum Make-Or-Break Moment: This Key Level Determines Path To Reach $7,000",BTC
2025-02-05,BitcoinOS Brings Trustless BTC Transactions to Ethereum via Arbitrum,BTC
2025-02-05,5 Best Altcoins to Watch Now for the Next Big Gains,BTC
2025-02-05,These 4 Altcoins Will Bounce Back Strong,BTC
2025-02-05,"Standard Chartered says bitcoin price could reach $500,000 by 2028",BTC
2025-02-05,"Crypto Price Analysis 2-5: BITCOIN: BTC, ETHEREUM: ETH, SOLANA: SOL, ALGORAND: ALGO, OPTIMISM: OP, RIPPLE: XRP, CELESTIA: TIA",BTC
2025-02-06,Czech Republic Passes Law: No Bitcoin Tax After 3 Years!,BTC
2025-02-06,"CleanSpark Q1 Earnings: Revenue Beat, EPS Beat, Shares Jump — 'Why Buy Bitcoin At Current Spot Prices When We Can Mine It For $34,000?'",BTC
2025-02-06,Czech President Petr Pavel Signs Law Eliminating Capital Gains Tax on Bitcoin for HODLERS After 3+ Years,BTC
2025-02-06,"Bitcoin, Ethereum, XRP, Dogecoin Grind Lower As Trader Warns: Choppy Above $95,500, Bearish Below",BTC
2025-02-06,"Solana’s BONK Roundtrips Total Gains From 2024, Here’s Why It’s A Good Buy Now",BTC
2025-02-07,"Maryland, Iowa, and Kentucky propose legislation to establish Bitcoin reserves",BTC
2025-02-07,Top 4 Solana Rivals to Transform $100 to $1000 this February,BTC
2025-02-07,QCP Crypto Market Update: Bitcoin Struggles Amid BERA Listing and Regulatory Shifts,BTC
2025-02-07,"Japan Urges App Stores to Remove Bybit, KuCoin, and Other Crypto Exchanges",BTC
2025-02-07,"This Week in Meme Coins: DOGE, SPX, FARTCOIN Crash Nearly 58%",BTC
2025-02-08,Chainlink Price Could Start ‘New Bull Rally’ – Here’s The Level To Watch,BTC
2025-02-08,Sony Ventures Into Music NFTs with Soneium and Coop Records,BTC
2025-02-08,Flare Fair Launch Offers Unique Gamified DeFi Experience,BTC
2025-02-08,"Dogecoin Price To $1, XRP To $6, And Solana To $1,000? Pundit Says You’re Not Bullish Enough",BTC
2025-02-08,Biggest Altcoin Losers in the First Week of February 2025,BTC
2025-02-09,Ethereum Spot ETFs Outshine Bitcoin Counterparts With Double Market Inflows – Details,BTC
2025-02-09,"As the BTC Bulls Prepare Break $109K Resistance, These 2 Hidden Gems Are Poised to Soar",BTC
2025-02-09,Bitcoin Taker Buy/Sell Ratio Spikes On Major Exchanges — Time To Buy?,BTC
2025-02-09,Dogizen and Bittensor price prediction: Could DOGIZ outpace TAO?,BTC
2025-02-09,"Binance Market Update: Top Stories February 9, 2025",BTC
2025-02-10,Berachain Co-Founder Accused of Dumping Tokens and Receiving Large Airdrop,BTC
2025-02-10,North Carolina becomes 20th US state to introduce legislation for a Bitcoin reserve,BTC
2025-02-10,'Ethereum Stole the Show': ETH Funds Trump Bitcoin ETF Gains,BTC
2025-02-10,Bitcoin Indicator That Timed January Top Now Gives Signal To Buy,BTC
2025-02-10,"Bitcoin, Ethereum, XRP, Dogecoin Walk Up: Is $100,000 BTC In Sight?",BTC
2025-02-11,How Trump’s Tariffs Could Impact Crypto and Bitcoin’s Potential in 2025,BTC
2025-02-11,Ark Invest CEO Cathie Wood: Bitcoin to hit $1.5 million as adoption surges,BTC
2025-02-11,"Bitcoin, Ethereum, XRP, Dogecoin Slide Lower: 'Final Move Down Before The Recovery,' Trader Says",BTC
2025-02-11,"Anthony Scaramucci Warns Meme Coins Create Market Contagion, Fuel Bitcoin Skepticism",BTC
2025-02-11,"BREAKING: 🇺🇸 Fed Chair Powell says he is ""struck"" by the growing number of cases of de-banked Bitcoin and crypto firms and he is ""determined to take a fresh look at that.""",BTC
2025-02-12,Berachain’s Post-Launch Performance Highlights Challenges for New Blockchains,BTC
2025-02-12,Plume and Mercado Bitcoin Partner to Tokenize $40M in Real-World Assets in Brazil,BTC
2025-02-12,CARV’s D.A.T.A. Framework 2.0: DeepSeek and CARV ID Integration for Enhanced Decision-Making,BTC
2025-02-12,"Arizona, Utah, and Oklahoma Take the Lead in Strategic Bitcoin Reserves Legislation",BTC
2025-02-12,Digital Asset Platform Mercado Bitcoin and Plume Network Tokenize $40M in Brazilian Assets,BTC
2025-02-13,Coinbase Q4 Earnings Highlights: Trading Platform Welcomes 'Dawn Of A New Era For Crypto',BTC
2025-02-13,"Bitcoin, Ethereum, Dogecoin Dip As XRP Holds Steady: Trader Warns Of Potential Drop To $92,000 Without Improvement",BTC
2025-02-13,Bitcoin Dips Below $95K as January CPI Data Shows Increasing Inflation. Can $MEMEX 100x?,BTC
2025-02-13,Here’s how Anthony Scaramucci’s crypto portfolio has performed in 2025 so far,BTC
2025-02-13,Bitcoin To $1.5 Million? Ark Invest CEO Cathie Wood Says It’s Coming,BTC
2025-02-14,Dogecoin Vs. Bitcoin: Popular Investor Says Memecoin More Superior With ‘World’s Best Chart’,BTC
2025-02-14,"With “Altcoin Season Over,” Warrior Coin Gains Traction in the Market",BTC
2025-02-14,"This Week in Meme Coins: SPX, POPCAT Rally Double-Digits While TRUMP Attempts Recovery",BTC
2025-02-14,"Crypto Biz: Goldman Sachs stacks ETH, BTC",BTC
2025-02-14,"Ethereum ‘Attractive’ Against Bitcoin at Current Level, Says Analyst Benjamin Cowen – Here’s His Outlook",BTC
2025-02-15,Uniswap Price Surges Past $10 — Bullish Pattern Suggests Further 30% Gain,BTC
2025-02-15,Strategy defies market trends as STRK and Bitcoin holdings surge,BTC
2025-02-15,What Will be Pi Network (PI) Launch Price: An Analytical Overview,BTC
2025-02-15,Senator Lummis Leads Push for Bitcoin in U.S. Economy,BTC
2025-02-15,"Standard Chartered sees bitcoin rebounding this weekend, bucking recent trend",BTC
2025-02-16,Elon Musk’s D.O.G.E looks to update US gold reserves with Bitcoin after Fort Knox audit,BTC
2025-02-16,"Bitcoin trades in tight range as XRP, LT, OM, and GT aim to move higher",BTC
2025-02-16,Crypto Analyst Predicts More Gains for Altcoin That Skyrocketed 920% in Just One Month,BTC
2025-02-16,NEAR Breaks Below Parallel Channel: Key Levels To Watch,BTC
2025-02-16,MicroStrategy’s STRK Becomes Top-Performing Perpetual Security in Just Two Weeks,BTC
2025-02-17,"XRP Set To Outshine Gold? Analyst Predicts 1,000% Surge",BTC
2025-02-17,Are Meme Coins Hurting Solana? Rising Selling Pressure Sparks Investor Concerns,BTC
2025-02-17,"The Daily: Javier Milei faces charges over memecoin scandal, Ethereum user spreads ‘brain control’ messages and more",BTC
2025-02-17,FBI and DoJ Could Charge Argentina’s President Milei Over the LIBRA Scandal,BTC
2025-02-17,"Price analysis 2/17: SPX, DXY, BTC, ETH, XRP, BNB, SOL, DOGE, ADA, LINK",BTC
2025-02-18,"As Elon Musk questions Fort Knox's gold, crypto voices say 'Bitcoin fixes this'",BTC
2025-02-18,"Kaiko Research: Bitfinex’s LEO, WBTC, and HYPE lead overvalued asset category, draw FTX/FTT comparison",BTC
2025-02-18,"Bitcoin, Ethereum, XRP, Dogecoin Slide: BTC's $80,000 Sweep Feels Like Hell For Altcoins But A Glorious Rebound Awaits",BTC
2025-02-18,"Dogecoin, Cardano Among Four Iconic Altcoins: Trader Sees 'Pretty Close To An End To This Chop'",BTC
2025-02-18,"The Daily: Curve Finance founder raises $5 million for new project, Libra memecoin scandal fallout continues and more",BTC
2025-02-19,Bitcoin Buying Pressure Wanes—Chart Reveals 60-Day Downtrend,BTC
2025-02-19,Coinbase Expands US Crypto Futures Market with CFTC-Regulated Solana Contracts,BTC
2025-02-19,"Price analysis 2/19: BTC, ETH, XRP, SOL, BNB, DOGE, ADA, LINK, XLM, LTC",BTC
2025-02-19,"Bitcoin, Ethereum, XRP, Dogecoin Rebound: $92,000 Key Downside Support Until $97,000-$98,500 Is Reclaimed, Analysts Say",BTC
2025-02-19,"The Daily: Binance.US restores fiat functionality, SEC considers Litecoin and XRP ETFs and more",BTC
2025-02-20,"The Daily: JPMorgan warns of crypto downside risk, Hashdex set to launch world’s first spot XRP ETF and more",BTC
2025-02-20,"FOMO HOUR, live with Sam Spratt",BTC
2025-02-20,Nansen’s Bitcoin On-Chain Analytics Reveal 42% Increase In BTC Transactions,BTC
2025-02-20,Solana Faces Double Trouble: 55% Network Drop And Price Woes,BTC
2025-02-20,Are XRP and DOGE Preparing for 25% Price Moves?,BTC
2025-02-21,Dogecoin Road To ATHs: Why $0.28 Is The Next Major Milestone For A Breakout,BTC
2025-02-21,"Bitcoin, Ethereum, XRP, Dogecoin See Friday Blues After Massive $1.4 Billion Bybit Hack",BTC
2025-02-21,North Korean Lazarus Group Identified As Culprit In Bybit’s Historic $1.5 Billion Hack,BTC
2025-02-21,"Altcoins Primed for a Massive Pump From Current Level, According to Crypto Analyst – But There’s a Catch",BTC
2025-02-21,Coinbase CEO’s Hot Take: Bitcoin Is Basically A ‘Meme Coin’,BTC
2025-02-22,Ethena Labs Confirms No Unrealized PNL Exposure to Bybit,BTC
2025-02-22,"2024 Crypto Report: Bitcoin Stable, Ethereum Declines, Niche Tokens Rally",BTC
2025-02-22,Altseason On The Way? Key DeFi Developments Signal Major Crypto Surge,BTC
2025-02-22,Easily Earn Crypto with STG Energy – Your Gateway to Passive Income,BTC
2025-02-22,"Altcoin Season Is Here Says Expert, Bitcoin Dominance At…",BTC
2025-02-23,Technical Indicator Shows Ongoing Rally For Dogecoin Despite Bearish Developments,BTC
2025-02-23,XRP Price Ready For A 14% Upswing? Here’s Its Potential Path,BTC
2025-02-23,"Bitcoin lacks strength, but ETH, BNB, XMR, and TAO show promise",BTC
2025-02-23,Michael Saylor Hints at MicroStrategy’s Next Major Bitcoin Acquisition,BTC
2025-02-23,Against The Tide: SEI Climbs 16% As Market Wobbles Post Bybit Hack,BTC
2025-02-24,"Major Regulatory Win: Circle’s USDC, EURC Become First Regulated Stablecoins in Dubai Financial Hub",BTC
2025-02-24,"Binance Founder CZ Discloses Private Portfolio Loaded With BNB, A Little Bitcoin",BTC
2025-02-24,Solana Faces Make-Or-Break Moment As $1.77 Billion Unlock Looms,BTC
2025-02-24,"Bitcoin, Ethereum, XRP, Dogecoin Slide Lower: 'BTC Coming Into A Critical Area – Bounce Or Die,' Trader Says",BTC
2025-02-24,"Crypto Falls after Hack, SOL underperforms, Sonic & Berachain heat up",BTC
2025-02-25,Solana Loses Long-Term Support Level – Analyst Shares Insights,BTC
2025-02-25,"Crypto Bear Market Callers Are Misguided, According to Investor Chris Burniske – Here’s Why",BTC
2025-02-25,"Bitcoin, Ethereum, XRP, Dogecoin See Blood-Red Tuesday As Traders Expect 'Period Of Consolidation Before Next Leg Down'",BTC
2025-02-25,Litecoin Retreat? A Drop Below $100 Still A Possibility—Analyst,BTC
2025-02-25,"Bitcoin Whales Scoop Up 26,430 BTC As Price Dips Below $88,000",BTC
2025-02-26,"UTXO, SNZ, and Jump Crypto among major institutions adopting sBTC",BTC
2025-02-26,Litecoin (LTC) price rallies while Bitcoin and the wider crypto market crash,BTC
2025-02-26,"The Daily: Bybit hack post-mortem suggests Safe infrastructure compromise, Bitcoin ETFs see record $1.1B outflows and more",BTC
2025-02-26,Aurora Labs Launches Instant Blockchain Deployment with Cloud Console,BTC
2025-02-26,"Price analysis 2/26: BTC, ETH, XRP, BNB, SOL, DOGE, ADA, LINK, SUI, AVAX",BTC
2025-02-27,"EXCLUSIVE: Bitcoin ETFs With Staking Could Transform Institutional Adoption, Says Bitlayer Co-Founder",BTC
2025-02-27,"Bitcoin, Ethereum, XRP, Dogecoin Struggle In Weak Market: 'I Don't Think That The Cycle Is Over,' Trader Says",BTC
2025-02-27,"Bitcoin Staking Industry Could Reach $10B By End Of 2025, Says Babylon Labs Co-Founder David Tse",BTC
2025-02-27,Aptos Price Climbs Even as Bitcoin and Ethereum Remain Sharply Down,BTC
2025-02-27,"The Daily: BlackRock’s Bitcoin ETF registers record outflows, Robinhood seeks to ‘unleash the true power of the crypto revolution’ and more",BTC
2025-02-28,"The Daily: Trump team files trademark for ‘TRUMP’ metaverse, bitcoin slipped under $80,000 and more",BTC
2025-02-28,"Bitcoin Cash price rallies 7% as BTC, ETH, XRP struggle: What follows?",BTC
2025-02-28,"Bitcoin CME Gap Is Still Open, Why $78,000 – $80,700 Are Very Important",BTC
2025-02-28,"All Bitcoin, XRP, ETH, AI, and D.O.G.E bets on Polymarket for March 2025",BTC
2025-02-28,"Price analysis 2/28: BTC, ETH, XRP, BNB, SOL, DOGE, ADA, LTC, LINK, AVAX",BTC
2025-03-01,Litecoin Price Shows Resilience In Uncertain Market Conditions — What’s Next For LTC?,BTC
2025-03-01,"Celestia (TIA) Aims For Breakout above $5, But Faces Challenge",BTC
2025-03-01,BlackRock puts 1-2% of allocation portfolios into its Bitcoin ETF,BTC
2025-03-01,"KAITO’s New All-Time High Depends on Bitcoin, Here’s Why",BTC
2025-03-01,Top 6 Coins for Big 2025 Gains,BTC
2025-03-02,Crypto’s First Act: How 2013 Set the Stage for a Financial Revolution,BTC
2025-03-02,"President Trump Reveals U.S. Crypto Reserve Bombshell — Sending BTC, ETH, Ripple’s XRP, Solana, And Cardano Rocketing",BTC
2025-03-02,"MICHAEL SAYLOR: ""Bitcoin is the foundation of the crypto economy.""",BTC
2025-03-02,Qubetics Crypto ICO Presale Surges Past $14.4M – This CertiK-Audited Project Thrives While Bitcoin & Litecoin Push the Market to New Heights in 2025,BTC
2025-03-02,"Bitcoin Will Explode Over $120,000 on Monday as ETF Demand Skyrockets Amid Trump’s BTC Reserve Announcement",BTC
2025-03-03,"Record $3,800,000,000 Flows out of Institutional Crypto Products in One Week: CoinShares",BTC
2025-03-03,Crypto Liquidations Near $1 Billion As Bitcoin & Altcoins Bounce Back,BTC
2025-03-03,TRON Price Implications as Justin Sun Hints TRX May Be in Trump’s Crypto Strategic Reserve,BTC
2025-03-03,Strategy Bitcoin steady as firm announces first preferred dividend,BTC
2025-03-03,"Bitcoin Open Interest Crashed To 6-Month Low, Here’s What Followed The Last Time",BTC
2025-03-04,Lazarus Finishes Laundering Stolen Bybit Funds Using THORChain,BTC
2025-03-04,BNB Holds Stronger Than Other Altcoins as Its Ecosystem Continues to Trend,BTC
2025-03-04,Litecoin Fails To Break Key Resistance Level Again – Can Bulls Hold Range Lows?,BTC
2025-03-04,US Treasury sanctions 49 Bitcoin and Monero addresses connected to shuttered darknet site Nemesis,BTC
2025-03-04,PlanB Says Bitcoin Bull Market at New Crossroads Following Deep Correction – Here’s His Outlook,BTC
2025-03-05,"Litecoin Whale Deposits 500,000 LTC To Binance: Price Decline To Extend?",BTC
2025-03-05,AXL’s price jumps 14% as Canary Capital files for Axelar ETF,BTC
2025-03-05,Arbitrum price could double with ease as AI partnership with Skynet sparks $23M inflows,BTC
2025-03-05,"Bitcoin Price Suffers Bearish Deviation After Filling CME Gap, Is This Good Or Bad?",BTC
2025-03-05,Here Are the Top 3 Cryptos with the Biggest Address Profitability,BTC
2025-03-06,"Bitcoin, Ethereum, Dogecoin Trend Lower, XRP Holds Steady As Texas Eyes Strategic BTC Reserve",BTC
2025-03-06,Mt. Gox Stirs The Market With $1 Billion Bitcoin Transfer—What’s Going On?,BTC
2025-03-06,"The Daily: David Sacks criticizes US government’s past bitcoin sales, JPMorgan sees less than 50% chance of crypto reserve approval and more",BTC
2025-03-06,Here are the the cryptocurrencies Donald Trump’s WLFI is buying in March,BTC
2025-03-06,"JPMorgan says XRP, SOL and ADA inclusion in US crypto reserve ‘would be difficult’",BTC
2025-03-07,"Bitcoin Price Crash Incoming? Why A Fall To $63,000 Is Possible If This Resistance Holds",BTC
2025-03-07,"Bitcoin, Ethereum, XRP Dip Ahead Of Crypto Summit, Dogecoin Shows Strength",BTC
2025-03-07,"The Daily: Trump orders Strategic Bitcoin Reserve akin to ‘digital Fort Knox,’ Ripple co-founder’s XRP loss tied to LastPass hack and more",BTC
2025-03-07,Trump’s Treasury Secretary Scott Bessent says Bitcoin acquisition plans are in discussion,BTC
2025-03-07,Trump Signs Executive Order to Create Bitcoin Strategic Reserve,BTC
2025-03-08,"Trump Blasts Biden Administration for Bitcoin Sales, Pledges to ‘Never Sell’",BTC
2025-03-08,"Sam Bankman-Fried Says 'When Rubber Meets The Road' On Crypto's Fate Under Trump, Slams Biden's Policies",BTC
2025-03-08,2025 is the year of RWAs: Real Women Assets leading web3,BTC
2025-03-08,Using Crypto to Unlock the Entrepreneurial Spirit of Women Globally,BTC
2025-03-08,"U.S banks can now legally handle crypto and stablecoins, says OCC",BTC
2025-03-09,"BTC, ETH, XRP Lead $334.99M Crypto Liquidation, Key Trends To Watch?",BTC
2025-03-10,"Cathie Wood Predicts “Deflationary Boom” As Bitcoin Price Falls Below $80,000",BTC
2025-03-10,"Bitcoin, Ethereum, XRP, Dogecoin Slide As 'Dump On Sunday, Continuation On Monday' Becomes The Norm",BTC
2025-03-10,"The Daily: Strategy’s latest $21 billion bitcoin plan, ‘signs of capitulation’ amid crypto market sell-off and more",BTC
2025-03-10,"Trump Excluded Binance Coin And Litecoin From US Crypto Reserves,  Analysts Say China, CZ's Past And Privacy Concerns Behind The Move",BTC
2025-03-10,"Bitcoin, Dogecoin Bled But These Gold-Backed Cryptos Preserved Investors' Wealth Last Week",BTC
2025-03-11,$931 Million Bitcoin On The Move: Mt. Gox Sparks Market Jitters,BTC
2025-03-11,Bitcoin and Crypto About To Be Boosted by Global Money Supply Explosion: Former Goldman Sachs Executive,BTC
2025-03-11,"The Daily: Sen. Lummis reintroduces bill for Trump’s Strategic Bitcoin Reserve, StarkWare establishes BTC treasury of its own and more",BTC
2025-03-11,"Bitcoin Reserve Upgrades Crypto But Paypal, Ripple Stablecoins Lag Behind",BTC
2025-03-11,Bitcoin Ordinals Not Dead! Taproot Wizards Opens Public Sale,BTC
