date,headline,crypto
2024-11-06,"Not Dogecoin But This Altcoin Is the Best Pick Post-Trump Win, Says Crypto CEO",ETH
2024-11-06,"Bitcoin, Ethereum, Dogecoin Explode To New Highs: 'BTC Bull Market Is Locked And Loaded For 2025, Says Trader'",ETH
2024-11-06,Shiba Inu Trading Volume Soars Over $1 Billion in Triple-Digit Surge,ETH
2024-11-06,"Vitalik Buterin deposits 2.09M STRK on Binance, realizing a $714K loss",ETH
2024-11-06,10x Research Outlines 5 Crypto Trades Following Donald Trump’s Election Victory,ETH
2024-11-07,Coinbase Brings its Wrapped Bitcoin to Solana,ETH
2024-11-07,"Bitcoin Hits Fresh All-Time High, Ethereum Rallies: 'Altseason Hasn't Even Begun,' Trader Says",ETH
2024-11-07,Crypto Whales Fuel 13% Rise in Lido (LDO) Price with $90 Million Accumulation,ETH
2024-11-07,"Hyperbridge Launches Its Mainnet on Polkadot, Unlocking Secure, Scalable Cross-Chain Communication",ETH
2024-11-07,"Trader Michaël van de Poppe Says Ethereum Flashing Massive Bullish Signal, Updates Outlook on Bitcoin and Sei",ETH
2024-11-08,Polygon's (POL) Web3 Unification Plans Get Magic Labs UX Boost,ETH
2024-11-08,"Bitcoin, Ethereum, Dogecoin Close The Week Trading Sideways",ETH
2024-11-08,"Ether set for $3.2K breakout, Coinbase exec urges SEC reform: Finance Redefined",ETH
2024-11-08,"The Daily: US bitcoin ETFs hit record $1.4 billion daily inflows, Ethereum Foundation report $789 million in crypto holdings and more",ETH
2024-11-08,Neiro Soars as Traders Eye 500% Rewards Coin – Is It Time to Make the Switch?,ETH
2024-11-09,"BTC & Stocks ATH, FED decision today, PNUT hits $125M",ETH
2024-11-09,"Telegram Coins Regain Momentum, TON & NOT Price To Jump 40%?",ETH
2024-11-09,"Ether Blows Past $3K, Builds Bullish Momentum After Trump's Election Win and Fed Rate Cut",ETH
2024-11-09,Top 3 Artificial Intelligence (AI) Coins of the First Week of November 2024,ETH
2024-11-09,Ethereum Price To Hit $10K As BTC Eyes $200K Rally: Standard Chartered,ETH
2024-11-10,3 Cryptocurrencies That Reached All-Time Highs Today — November 10,ETH
2024-11-10,Biggest Altcoin Gainers of the First Week of November 2024,ETH
2024-11-10,"Ethereum Surpasses $3,000, Three Reasons Behind Comeback",ETH
2024-11-10,Polymarket Teases Token Launch as Platform Looks Beyond Election Hype,ETH
2024-11-10,Scroll Review: Enhancing Ethereum’s Scalability with zkEVM,ETH
2024-11-11,"Bitcoin Shatters $87,000 All-Time High, Ethereum Up 5%, Dogecoin Blasts Through 30 Cents For 20% Gain In Memorable Monday Trading Session",ETH
2024-11-11,"Bitcoin Shatters $87,000 All-Time High, Ethereum Up 5%, Dogecoin Blasts Through $0.30 For 20% Gain In Memorable Monday Trading Session",ETH
2024-11-11,"Hive Digital buys 6,500 ASICs, starts Paraguay construction",ETH
2024-11-11,"Price analysis 11/11: SPX, DXY, BTC, ETH, SOL, BNB, DOGE, XRP, ADA, TON",ETH
2024-11-11,Near Protocol to Build World’s Largest Open-Source AI Model,ETH
2024-11-12,Ethereum Mulls Major Consensus Layer Overhaul: What Beam Chain Entails,ETH
2024-11-12,Meet the Ethereum Beam Chain,ETH
2024-11-12,Solana Now Rivals Ethereum In Nearly All Major Economic Metrics With Consistent Growth!,ETH
2024-11-12,"Bitcoin Nears $90,000, Dogecoin Soars, Ethereum Steady — Trader Eyes $100,000 Breakout If Milestone Hits Today",ETH
2024-11-12,"The Daily: Justin Drake proposes Ethereum consensus layer redesign, German government misses out on $1.6B by selling bitcoin early and more",ETH
2024-11-13,"Bitcoin, Dogecoin and Solana Live As Arkham Exchange Commence Trading",ETH
2024-11-13,"The Daily: Trump says ‘DOGE’ to be led by Musk and Ramaswamy as Dogecoin soars, Bitwise CIO makes the case for $500K bitcoin and more",ETH
2024-11-13,BlackRock’s BUIDL Fund Now Compatible Across Major Blockchains for Greater Access,ETH
2024-11-13,NEIRO’s 18% Price Drop Prompts Long-Term Holders To Dump Tokens,ETH
2024-11-13,"BlackRock expands BUIDL to Aptos, Arbitrum and Optimism",ETH
2024-11-14,Crypto Markets Surge After Trump’s Victory,ETH
2024-11-14,Top 5 Ethereum Tokens to Buy to Turn $1K to $1M in November,ETH
2024-11-14,"Polygon Rival Primed To Explode by Over 200% in Weeks, According to Crypto Analyst Michaël van de Poppe",ETH
2024-11-14,"NEIRO Makes New ATH, Meme Season Gears Up, What Next?",ETH
2024-11-14,XRP Ledger To Host Societe Generale-Forge’s EURCV Stablecoin,ETH
2024-11-15,"Trader Michaël van de Poppe Says Ethereum-Based Altcoin on Cusp of ‘Big Breakout,’ Updates Outlook on Bitcoin",ETH
2024-11-15,"Bitcoin Pushes Back Above $90,000, Ethereum, Dogecoin Lag To End A Record Week",ETH
2024-11-15,4 Crypto That Could Explode in November?,ETH
2024-11-15,Cardano Tops Poll as L1 Most Likely to Flip Ethereum,ETH
2024-11-15,Kraken Ink Unveils Self-Withdrawal and Fault Proof Testing as Mainnet Launch Nears,ETH
2024-11-16,Ethereum 'dying a slow death' as ETH breaks 8-year trend vs. Bitcoin,ETH
2024-11-16,"Decentraland’s MANA Skyrockets 33% in 24 Hours, Leaving Competitors Behind!",ETH
2024-11-16,Altcoin Market Experiences Brief Respite With Notable Gains,ETH
2024-11-16,"Binance Market Update: Top Stories November 16, 2024",ETH
2024-11-16,Will FLARE Price Break $0.025 and Surge 85% To $0.03820?,ETH
2024-11-17,Spot Ethereum ETFs See $515 Million Record Weekly Inflows – Details,ETH
2024-11-17,Polkadot Price Soars 15% In One Day — Here’s Why $7.5 Might Be The Next Target,ETH
2024-11-17,"Binance Market Update: Top Stories November 17, 2024",ETH
2024-11-17,Ethereum Classic – Trend reversal in sight? Watch out for these key ETC levels!,ETH
2024-11-17,'More brutal than expected' — Lyn Alden on ETH/BTC post-election low,ETH
2024-11-18,"Bitcoin, Ethereum Open The Week Relatively Flat, Dogecoin Moves Higher, Trader Marks $91,000 As Key BTC Level To Prevent 'Cool Off'",ETH
2024-11-18,Vitalik Buterin Praises Starknet’s Efforts to Boost Ethereum Scaling Solutions,ETH
2024-11-18,Solana’s Monthly DEX Volume Breaks $70B for the First Time,ETH
2024-11-18,"Price analysis 11/18: SPX, DXY, BTC, ETH, SOL, BNB, XRP, DOGE, ADA, SHIB",ETH
2024-11-18,"Solana Overtakes Ethereum as Top Chain on Nansen, Raydium Rakes in Record Fees",ETH
2024-11-19,California Court Rules That Ethereum Liquid Staking Solution Lido To Be Treated As Legal Entity,ETH
2024-11-19,"Bitfinity bridges Bitcoin and Ethereum with new Layer-2 mainnet, raises $12 million",ETH
2024-11-19,NEIRO Rebound to $0.0030 Likely as Profit-Taking Stays Minimal,ETH
2024-11-19,Ethereum DApp volumes gain 38% in a month — Will ETH price follow?,ETH
2024-11-19,Ethereum Giants Formerly Known as MakerDAO and DAI Now on Solana,ETH
2024-11-20,"Bitcoin Holding On To $94,000, Ethereum, Dogecoin Trade Lower: 'Place Your Bets, Up Or Down Brothers,' Says Trader",ETH
2024-11-20,Meme Coin Madness Trading Competition Guide,ETH
2024-11-20,"'Dogecoin Millionaire' Shares $50 Million Meme Coin Strategy For 2025: Pepe, Brett Are This Bull Run's DOGE, Shiba Inu",ETH
2024-11-20,Coinbase to Suspend WBTC Trading Amid Rise of cbBTC,ETH
2024-11-20,What Happened in Crypto Market Today: Latest Updates And Insights,ETH
2024-11-21,Crypto market maker B2C2 taps PV01 to issue its first corporate bond on Ethereum,ETH
2024-11-21,"Bitcoin, Ethereum, Dogecoin Prepping For An Early Thanksgiving: 'BTC Is Currently (Less Than) One ETH Away From $100,000,' Says Trader",ETH
2024-11-21,"If You Invested $1,000 In Ethereum At Launch, Here's How Much You'd Have Today",ETH
2024-11-21,How The DAO Hack Changed Blockchain Security,ETH
2024-11-21,"Crypto Trader Says One Top-50 Altcoin Could Go Up by Over 100%, Updates Outlook on Bitcoin and Ethereum",ETH
2024-11-22,"Mythical Games and FIFA Announce New Mobile NFT Football Game, FIFA Rivals",ETH
2024-11-22,Ethereum gains momentum as analysts confirm ‘altcoin season’ is here,ETH
2024-11-22,Is Solana price primed for more upside now that SOL hit a new all-time high?,ETH
2024-11-22,Bitcoin LTHs Start Taking Profits – Metrics Reveal Whales Are Actively Spending,ETH
2024-11-22,Ethereum (ETH) Becomes Censorship-Resistant With This Upgrade,ETH
2024-11-23,Ethereum's EIP 7805 Aims to Enhance Censorship Resistance,ETH
2024-11-23,"Ethereum-to-bitcoin ratio plummets to three-year low as BTC approaches $100,000",ETH
2024-11-23,"Solana Hits Record Fees Amid Meme Coin Surge, but Faces Long-Term Risks",ETH
2024-11-23,Smart Money Profits From Strategic ETH and WBTC Trades,ETH
2024-11-23,Cardano (ADA) Jumps to Top Section of Weiss Crypto Ranking,ETH
2024-11-24,SPX6900 price prediction 2025-2031: Will SPX6900 soar 10x or crash?,ETH
2024-11-24,Cardano Achieves 'A' Rating in Weiss Crypto Rankings,ETH
2024-11-24,"This Is Why Ethereum (ETH) Risks Falling Below $3,000",ETH
2024-11-24,$500M WBTC Burned in the Wake of Coinbase’s Delisting Move,ETH
2024-11-24,"SAND Rockets 55% in a Day, Outpaces Market Giants with $1.91 Billion Volume",ETH
2024-11-25,"What’s New in AI for Crypto: The Graph Launches GRC-20, NEAR Integrates MetaMask, ASI Alliances Introduces FET Staking Platform",ETH
2024-11-25,"Top Crypto News This Week: Sonic Mainnet to Launch, Avalanche Etna Goes Live, Jupiter’s Jupuary Starts Voting",ETH
2024-11-25,"EXCLUSIVE: Tim Draper Predicts Bitcoin To Reach $120K By End Of 2024, $250K In 2025",ETH
2024-11-25,"Bitwise To Back Starknet Staking, STRK Price Reacts",ETH
2024-11-25,"President Donald Trump holds over $5.4 million in cryptos, Ether is his largest",ETH
2024-11-26,"Trump team looking to shift crypto regulation to CFTC, dilute SEC’s role: report",ETH
2024-11-26,"Bitwise files for Bitcoin-Ethereum ETF with SEC, plans NYSE launch",ETH
2024-11-26,Starknet launches STRK staking Phase 1 with decentralization goals,ETH
2024-11-26,"Best Crypto to Buy Now November 26 – INJ, FTM, PEPU",ETH
2024-11-26,Top Trader Eugene Ng Ah Sio Buys Ethereum Amid Market Uncertainty,ETH
2024-11-27,Celsius to Distribute $127 Million in Second Payout to Creditors,ETH
2024-11-27,Bitwise files for 10-crypto index ETF with SEC,ETH
2024-11-27,BitWise Files for 10 Crypto Index ETF with SEC,ETH
2024-11-27,"Bitcoin, Ethereum, Dogecoin Heat Up In Pre-Thanksgiving Rally: 'Buy The Fear, Sell The Greed, Rinse And Repeat,' Says Trader",ETH
2024-11-27,21Shares Is Launching Four New Crypto ETPs Focusing on AI Tokens,ETH
2024-11-28,"Solana Reports $4 Billion Inflows, Hits $240; Generates $2.33M in Royalties and $200M in Fees, Surpassing Ethereum",ETH
2024-11-28,Crypto Expert Unveils 15 Surprising Truths About This Bull Run You Need To Know,ETH
2024-11-28,"European Stocks Close Higher, Dollar Gains, Bitcoin Eases To $95,000: What's Driving Markets Thursday?",ETH
2024-11-28,"Ethereum DeFi TVL hits 2-year high as activity on platforms like Uniswap, Aave soars",ETH
2024-11-28,Polygon Co-founder Questions Vitalik Buterin’s Praise for Solana and Not Polygon PoS,ETH
2024-11-29,Selling ETH for BTC: Leading Chinese Gaming Firm Converts,ETH
2024-11-29,"Bitcoin, Ethereum, Dogecoin Climb, But Ripple Rockets: Analyst Calls It 'An Insane Period'",ETH
2024-11-29,"Dogecoin TD Sell Signal Goes Off, But Here’s Why Parabolic Bull Run Can Still Continue",ETH
2024-11-29,Wrapped Litecoin (WLTC) pool goes live on Uniswap,ETH
2024-11-29,Ethereum layer-2 volumes rose by 70%— Will they eclipse Solana,ETH
2024-11-30,Top Crypto Trader Says Altcoins To Pop Off Amid Bullish Signals on Bitcoin Charts – Here Are His Top Picks,ETH
2024-11-30,"BTC at $97K, HYPE has Massive Airdrop, VIRTUAL hits $1.4B FDV",ETH
2024-11-30,"What Happened in Crypto Market Today: XRP Surges, ETH ETF Inflows",ETH
2024-11-30,XLM Price Prediction: Can Stellar’s 474% Growth Lead to $1 by December?,ETH
2024-11-30,Wormhole Review: Advanced Interoperability for a Multichain Ecosystem,ETH
2024-12-01,Dogecoin To $3? Expert Says The Countdown Has Begun – Details,ETH
2024-12-01,"How BlackRock, Fidelity ETFs Are Driving Price Of Ethereum Up",ETH
2024-12-01,Coinbase’s Base Network Prioritizes Growth Without a Native Token,ETH
2024-12-01,"Cardano’s Charles Hoskinson apologizes to rival ecosystems, calls for unity in 2025",ETH
2024-12-01,Balaji Srinivasan proposes Zethereum to boost Ethereum privacy using ZK tech,ETH
2024-12-02,"Bitcoin, Ethereum, Dogecoin Dip, But Trader Predicts $100,000 Bitcoin Breakout Followed By 20-25% Correction",ETH
2024-12-02,Unlocking Ethereum’s Potential: Why Analysts Are Bullish on ETH Staking Yields,ETH
2024-12-02,Staking may come soon for US Ether ETFs: Bernstein,ETH
2024-12-02,"Best Crypto to Buy Now December 2 – HBAR, KAIA, IOTA",ETH
2024-12-02,"The Daily: XRP is back in crypto’s top three, Michael Saylor advises Microsoft on adopting bitcoin and more",ETH
2024-12-03,"Bitcoin, Ethereum, Dogecoin Hold Steady, Trader Eyes Buying Opportunity If BTC 'Hits Lower Numbers Around $90,000'",ETH
2024-12-03,Meme Coins in the Crosshairs: US Government Moves 54 Billion SHIB,ETH
2024-12-03,BRETT price prediction 2025-2031: IS BRETT a good investment?,ETH
2024-12-03,Ethereum’s monthly onchain volume hits $183.7 billion in November,ETH
2024-12-03,Vitalik Buterin Proposes Privacy-Focused Ethereum Wallets with ZK-SNARK Integration,ETH
2024-12-04,"US Govt Moves 54.9 billion Shiba Inu, But SHIB Could Explode By 130%",ETH
2024-12-04,"US Government Transfers $33M in ETH, BUSD, and SHIB, Seized From FTX",ETH
2024-12-04,"Bitcoin, Ethereum, Dogecoin Recover From Mid-Day Slump, Close Day Strong On Powell's 'Digital Gold' Remarks",ETH
2024-12-04,Trump To Swap Hegseth For DeSantis? Here's What Polymarket Odds For Defense Secretary Pick Show,ETH
2024-12-04,"Ethereum, Avalanche and One Additional Altcoin Holding Supports and Gearing Up for More Moves: Rekt Capital",ETH
2024-12-05,Ethereum faces a $500M blow as Uniswap’s shift to Unichain challenges the deflationary model,ETH
2024-12-05,‘China’s MicroStrategy’ sells all of its Bitcoin and Ethereum: Asia Express,ETH
2024-12-05,"This Ethereum-Based Altcoin Looks Ready To Explode by Over 500%, According to Crypto Analyst Justin Bennett",ETH
2024-12-05,"Bitcoin Breaks $100,000, Falls Back Below, Ethereum, Dogecoin Follow Lower: A 'Scam Dump' To Wipe Out Leverage?",ETH
2024-12-05,Phantom Wallet Adds Sui as the Blockchain’s TVL Reaches Record $1.72 Billion,ETH
2024-12-06,"Worldcoin, Mantle Display Strong Rally Even As Ethereum Altcoins Still Struggle",ETH
2024-12-06,Ethereum (ETH)-Based Meme Token MOG Coin (MOG) Rips Following Coinbase Listing,ETH
2024-12-06,Ethereum Hits 3-Year High as ETFs See Record $752 Million Weekly Inflows,ETH
2024-12-06,Ethereum ‘impulse breakout’ will lead to $15K ETH price in 2025 — Analyst,ETH
2024-12-06,"If You Invested $1,000 In Bitcoin When Trump Said US Will Be 'Crypto Capital Of The World,' Here's How Much You'd Have Today",ETH
2024-12-07,"Can Bitcoin, Ethereum, Dogecoin, Shiba Inu or Solana Beat XRP In 2025? Poll Says Yes, One Coin Stands Out",ETH
2024-12-07,Layer-2 networks need decentralized sequencers — Metis co-founder,ETH
2024-12-07,Mog Coin (MOG) & FLOKI (FLOKI) Lead the Memecoin Rally—Here’s What Awaited in the NEXT 48 hours,ETH
2024-12-07,Mog Crypto Hits $1.5 Billion Market Cap Amidst Coinbase Listing,ETH
2024-12-07,Bitcoin Cash and Ethereum Classic Disappoint Investors As Lunex Network Soars During the Bull Run,ETH
2024-12-08,Vitalik says Ethereum must prioritize verifiability and democracy,ETH
2024-12-08,"Uniswap: $38 Billion Volume, Big Jump In Price, What’s Behind The Rise?",ETH
2024-12-08,XRP To Maintain Price Rally As Whales Reload Amidst Price Dip- Details,ETH
2024-12-08,"PEPE Market Cap Hits $10 Billion, Flips Litecoin After 18% Price Increase",ETH
2024-12-08,Uniswap Consolidates At $17: A Calm Before The Bullish Storm?,ETH
2024-12-09,MOVE Token Reaches $1.6 Billion Market Cap After Airdrop Launch on Binance,ETH
2024-12-09,"Circle to Launch CCTP V2 for Faster USDC Transfers with Low-Latency Settlements on Ethereum, Base, and Avalanche in Early 2025",ETH
2024-12-09,Justin Sun dumps $119M Ethereum as price soars past $4K – What’s happening?,ETH
2024-12-09,"DeFi TVL nears 2021 highs on liquid restaking, Bitcoin L2s",ETH
2024-12-09,"Bitcoin, Ethereum, Dogecoin Turn Red: 'Timeline Got Bearish,' Trader Notes",ETH
2024-12-10,"Top Signal? Ethereum Foundation Sells $374,000 ETH on Decentralized Exchange",ETH
2024-12-10,"New York Regulatory Approves Ripple Stablecoin RLUSD, As XRP Surges 10%",ETH
2024-12-10,"Bitcoin, Ethereum, Dogecoin Double Down On Losses But One Indicator Gives Bulls Hope",ETH
2024-12-10,"The Daily: Satoshi’s thoughts on quantum computing, Trump would ‘love’ bitcoin to hit $150,000 and more",ETH
2024-12-10,Raydium beats Uniswap in monthly DEX volumes again,ETH
2024-12-11,Raydium Dominates Solana DEX Volumes as RAY Price Approaches $6 Resistance,ETH
2024-12-11,BlackRock and Fidelity ETFs purchase $500 million worth of ETH in the past two days: Arkham,ETH
2024-12-11,Solana Welcomes Ethereum Prodigy – Is A Price Surge On The Horizon?,ETH
2024-12-11,TON DLT Foundation Launches in Abu Dhabi With ADGM Registration,ETH
2024-12-11,"Price analysis 12/11: BTC, ETH, XRP, SOL, BNB, DOGE, ADA, AVAX, TON, SHIB",ETH
2024-12-12,The Shib News Recap: Thursday,ETH
2024-12-12,Peanut The Squirrel (PNUT) Coin Skyrockets 31% Post-Coinbase Debut,ETH
2024-12-12,Eigen Foundation commits 1% of EIGEN supply to ETH Protocol Guild,ETH
2024-12-12,Argentina’s President Plans To Embrace Bitcoin Payments in 2025,ETH
2024-12-12,Chainlink And AAVE Surge After Trump’s Crypto Project Invests In Both,ETH
2024-12-13,Ubisoft Integrates Ethereum Name Service for Captain Laserhawk Universe,ETH
2024-12-13,"Crypto Today: XRP, BNB advance as Blackrock records 16-day Ethereum buying spree",ETH
2024-12-13,Uniswap Bounces Back From Slow Summer,ETH
2024-12-13,"Layer-1 Blockchain Avalanche (AVAX) Announces $250,000,000 Token Sale Ahead of Upcoming Upgrade",ETH
2024-12-13,"Bitcoin, Ethereum, XRP, Dogecoin Close The Week Strong: 2025 Could Get Even Better, Say Traders",ETH
2024-12-14,Decentralized Oracle Network Chainlink Leads Real-World Assets Sector in Recent Development Activity: Santiment,ETH
2024-12-14,"NFT Buyers Vanish, but Sales Spike: Ethereum Dominates $224M Week",ETH
2024-12-14,NEAR Protocol Mainnet Is First MetaMask Compatible Non-EVM Chain,ETH
2024-12-14,"Ethereum poised for record highs in Q1 2025, analysts predict",ETH
2024-12-14,Ethereum Layer 2 Networks Experience Decline In Total Value Locked,ETH
2024-12-15,"ETH, LINK, AAVE and BGB move higher as Bitcoin inches toward new all-time high",ETH
2024-12-15,New Slashing Mechanism in ELIP-002 Enhances Accountability Across EigenLayer Ecosystem,ETH
2024-12-15,Which is the Best Crypto for 2025? MIT Talent Maurice Herlihy Led AMA Pits BlockDAG Ahead of Ethereum Classic and Cronos,ETH
2024-12-15,"Ethereum Forming A Symmetrical Pattern – Key Resistance At $4,100",ETH
2024-12-15,"Trump’s WLFI Spends $44M in Crypto, Gains $2.33M Profit",ETH
2024-12-16,USDC Treasury Mints 50 Million USDC on Ethereum Blockchain,ETH
2024-12-16,"Avalanche of Institutional Money Continues Into Crypto Products With $3,200,000,000 in Inflows: CoinShares",ETH
2024-12-16,Ethereum Game ‘Pixels’ Spawns Play-to-Earn Dungeon Crawler on Ronin,ETH
2024-12-16,Justin Sun Dumping Ethereum: Will ETH Price Action Slow Dow?,ETH
2024-12-16,Dogecoin Creator Reveals His Top 5 Crypto Picks and There’s No Room For Ripple’s XRP,ETH
2024-12-17,"Bloomberg Analyst Predicts 2024 Wave of Crypto ETFs Starting with BTC, ETH, Litecoin, HBAR, XRP, and Solana",ETH
2024-12-17,"Bloomberg Analyst Predicts Litecoin, HBAR, Solana, XRP ETFs for 2025",ETH
2024-12-17,Pudgy Penguins’ PENGU Token and NFTs Plummet 50% Following Airdrop,ETH
2024-12-17,"Bloomberg analysts predict wave of crypto ETFs in 2025, targeting XRP, Solana, and HBAR",ETH
2024-12-17,"Wormhole, EigenLayer and NEAR-focused Nuffle Labs partner to bring restaking beyond Ethereum",ETH
2024-12-18,Kraken’s Layer-2 Blockchain Ink Goes Live on Mainnet Ahead of Schedule,ETH
2024-12-18,Coinbase Says Justin Sun ‘Unnacceptable Risk’ to Wrapped Bitcoin After Delisting wBTC,ETH
2024-12-18,XRP Price Ready To Run To $11 ATH? Alternative Larger Metrics Show The Answer,ETH
2024-12-18,Bitcoin price drops to $100.3K after Fed rate cut and Powell’s revised 2025 inflation outlook,ETH
2024-12-18,Lens by Avara secures $31M for SocialFi-focused L2 blockchain,ETH
2024-12-19,Aave-Chan Initiates Proposal to Deploy Aave v3 on Sonic,ETH
2024-12-19,"Bitcoin, Ethereum, XRP Plunge Over 6% Each, Dogecoin Drowns 14% On Turbulent Post-FOMC Thursday",ETH
2024-12-19,"Meme Coins Overtake BTC, BNB in Popularity Among Crypto Holders: Binance",ETH
2024-12-19,"Venus Protocol Launches on Base Chain, Transforming DeFi Landscape on Base",ETH
2024-12-19,Mantle Network Advances Technical Roadmap As the First ZK Validity Rollup With Succinct’s SP1,ETH
2024-12-20,SEC Approves First BTC-ETH Index ETFs,ETH
2024-12-20,"Bitcoin Cash Price Forecast: 40,000 investors sell BCH as BTC, ETH lead crypto crash",ETH
2024-12-20,"Coinbase Withdraws Support for Wrapped Bitcoin (wBTC) As BTC Careens Below $100,000",ETH
2024-12-20,"Bitcoin, Ethereum, XRP, Dogecoin Whipsaw, But These 4 Key Factors Make It A 'Hiccup,' Not A Downturn",ETH
2024-12-20,"Analyst Justin Bennett Says Ethereum-Based Altcoin Could Explode by Over 600%, Updates Outlook on Solana",ETH
2024-12-21,Bad Idea AI Expands Web3 Utility with $BAD Token Listing on Crypto.com On-Chain Wallet,ETH
2024-12-21,Solana MVRV Signals More Gains Ahead Amid Market Downturn: Analysts,ETH
2024-12-21,Binance Market Update (2024-12-21),ETH
2024-12-21,Ethereum NFT collections drive weekly volume to $304M,ETH
2024-12-21,Biggest Altcoin Gainers of the Third Week of December 2024,ETH
2024-12-22,Ethereum and Solana NFT Scammers Charged in $22 Million Rug Pull Scheme,ETH
2024-12-22,"Ethereum Set To Move Up Against Bitcoin, According to Analyst Benjamin Cowen – Here’s His Outlook",ETH
2024-12-22,Does Ethereum Need Its Own Michael Saylor? A Look at the Crypto Community’s Reaction,ETH
2024-12-22,Why Ethereum Classic could be setting up for a 20% price jump,ETH
2024-12-23,Top 3 Airdrops to Watch for the Christmas Week,ETH
2024-12-23,Aave Considers Chainlink Oracle Integration To Capture MEV Profits,ETH
2024-12-23,Aave mulls Chainlink integration to return MEV fees to users,ETH
2024-12-23,"Exclusive Insights: Founders Of Polygon, SkyBridge, Custodia, WonderFi & Cardone Bullish On BTC in 2025",ETH
2024-12-23,IRS Calls Crypto Staking Taxable Amid Ongoing Lawsuit,ETH
2024-12-24,Bitcoin Ends Week with $375M Inflows as Multi-Asset Products Face $121M in Losses,ETH
2024-12-24,Top Crypto Trends of 2024: From AI Agents to Modular Blockchains,ETH
2024-12-24,Will Ethereum Hit 10K? Examining ETH’s Potential,ETH
2024-12-24,Bullish Officially Adds RLUSD Stablecoin,ETH
2024-12-24,Bullish lists Ripple’s RLUSD – Here are the available trading pairs,ETH
2024-12-25,Top 10 Altcoins Under $1 to Invest in 2025,ETH
2024-12-25,Sonic Labs launches FTM to S token swaps via Gateway,ETH
2024-12-25,"$ETH I think it's a matter of time when ETH makes new all time highs and pulls the entire altcoin market with it.

Might be choppy getting there, but once it does break, the expansion is usually very quick.",ETH
2024-12-25,"Price analysis 12/25: BTC, ETH, XRP, SOL, BNB, DOGE, ADA, AVAX, LINK, TON",ETH
2024-12-25,Ethereum NFTs Propel Weekly Sales To Over $300 Million,ETH
2024-12-26,"Ethereum co-founder Vitalik Buterin ‘adopts’ viral pygmy hippo Moo Deng with $293,000 donation to Thai zoo",ETH
2024-12-26,"Defi Doesn’t Sleep—Mystery Whale Dumps 125,000 ETH Into Aave on Christmas Day",ETH
2024-12-26,Which Crypto ETFs Could Be Launched in 2025? These Cryptos Could Be the Next,ETH
2024-12-26,"Crypto Price Analysis 12-26 BITCOIN: BTC, ETHEREUM: ETH, SOLANA: SOL, BITTENSOR: TAO, FANTOM: FTM, CELESTIA: TIA, INTERNET COMPUTER: ICP",ETH
2024-12-26,"ZND Expands Ecosystem with Special Pool Rewards, New Tradable Assets, and Holiday Campaigns",ETH
2024-12-27,"January Looks Promising for Solana, Ethereum, Kaspa, and XYZVerse as Bull Run Gains Momentum",ETH
2024-12-27,Mantle Recaps its 2024 and Unveils Ambitious Plans for Next Year,ETH
2024-12-27,"Bitcoin Dumps Below $95,000, Ethereum, XRP, Dogecoin Meander In Lackluster Friday Trading Session",ETH
2024-12-27,Bitget sets to innovate gas payments with BGB token amid major 40% supply burn,ETH
2024-12-27,"Ethereum NFT volume hits $186 million weekly high, driven by PENGU token launch",ETH
2024-12-28,Chainlink Price Could Crash 30% To $15 — Here’s How,ETH
2024-12-28,Galaxy Predicts No Bitcoin Purchase by US in 2025 Despite Nation-State Adoption,ETH
2024-12-28,Virtual Reality Platform Decentraland Continues To Lead Santiment’s Rankings of Top NFT Projects by Development,ETH
2024-12-28,"Benzinga Bulls And Bears: Quantum Computing, Tesla, AMD — And Whales Buy 270 Million Dogecoin Over 4 Days",ETH
2024-12-28,A 20%-30% Correction Is ‘The Most Bullish Thing’ That Could Happen To Bitcoin – Analyst,ETH
2024-12-29,"NEIRO Coin: MACD Signals Potential Reversal, Can It Rally Over 220%",ETH
2024-12-29,Shiba Inu Expands Metaverse With Chainlink’s CCIP,ETH
2024-12-29,How to Buy 2025’s Top Cryptos Easily and Secure the Best Entry Price,ETH
2024-12-29,"Best Cryptos to Join Now for 2025 Bull Run: Why BlockDAG, Ethereum, Avalanche, & XRP Should Be on Every Trader’s Radar!",ETH
2024-12-29,"Here’s Why Bitcoin, Ethereum, BNB, XRP & Web3Bay are the 5 Top Bullish Cryptos to buy",ETH
2024-12-30,USDC Treasury Issues 450 Million Tokens on Ethereum,ETH
2024-12-30,Crypto Crystal Ball 2025: Could Ethereum Updates Finally Bring Mass Adoption?,ETH
2024-12-30,"Top Picks for 2025: A Guide to the Best Crypto Coins Including Bitcoin, Ethereum, BNB, XRP, & Web3Bay",ETH
2024-12-30,"Price analysis 12/30: SPX, DXY, BTC, ETH, XRP, BNB, SOL, DOGE, ADA, AVAX",ETH
2024-12-30,"2025 Outlook: Bitcoin To $150,000, Ethereum To $5,500, Dogecoin Hits $1, Galaxy Research Predicts",ETH
2024-12-31,"Bitcoin Bearish Flag Pattern Says Crash Is Far From Over Despite Crash To $91,000",ETH
2024-12-31,Top Meme Coin Moments of 2024,ETH
